id,movie_name,Duration,year,genre,director,actors,country,rating,enter_in_netflix
1955,MR. RIGHT,96,2015,"Action & Adventure, Comedies, Romantic Movies",Paco Cabezas,"Sam Rockwell, Anna Kendrick, Tim Roth, James Ransone, Anson Mount, Michael Eklund, RZA, Katie Nehra",United States,6.3,"February 16, 2020"
1956,Ma Chu Ka,117,2017,"International Movies, Thrillers",Jayan Vannery,"Pasupathy, Janani Iyer, Pratap Pothen",India,6.2,"July 1, 2018"
1957,Maacher Jhol,107,2017,"Dramas, International Movies",Pratim D. Gupta,"Ritwick Chakraborty, Mamata Shankar, Paoli Dam, Kaya Blocksage, Sauraseni Maitra, Arjun Chakrabarty","India, France",7.0,"January 1, 2018"
1958,Mac & Devin Go to High School,76,2012,Comedies,Dylan C. Brown,"Snoop Dogg, Wiz Khalifa, Mike Epps, Teairra Mari, Derek Kane, Luenell, Teni Panosian, Paul Iacono, Andy Milonakis, Mystikal",United States,4.4,"April 20, 2016"
1959,Macchli Jal Ki Rani Hai,118,2014,"Horror Movies, International Movies",Debaloy Dey,"Swara Bhaskar, Bhanu Uday, Murli Sharma, Deep Raj Rana, Reema Debnath, Hemant Pandey, Saurabh Dubey, Sakha Kalyani",India,2.5,"October 15, 2017"
1960,Macho,101,2016,"Comedies, International Movies, LGBTQ Movies",Antonio Serrano,"Miguel Rodarte, Cecilia Suárez, Aislinn Derbez, Renato López, Mario Iván Martínez, Valeria Vera, David Zorrilla, Ana de la Reguera, Manolo Cardona, Ofelia Medina",Mexico,4.3,"April 12, 2017"
1961,Mad Ron's Prevues from Hell,84,1987,"Cult Movies, Horror Movies",Jim Monaco,"Nick Pawlow, Jordu Schell, Jay Kushwara, Michael Townsend Wright, Anthony Kelly, Happy Goldsplatt, Ron Roccia, Fred Pomerleau, Joe Amodei, Nicholas Kitsopoulos",United States,6.1,"November 1, 2010"
1962,Mad World,102,2016,"Dramas, International Movies",Chun Wong,"Shawn Yue, Eric Tsang, Elaine Jin, Charmaine Fong",Hong Kong,7.3,"September 20, 2018"
1963,Madagascar: Escape 2 Africa,91,2008,"Children & Family Movies, Comedies","Eric Darnell, Tom McGrath","Ben Stiller, Chris Rock, David Schwimmer, Jada Pinkett Smith, Sacha Baron Cohen, Cedric the Entertainer, Andy Richter, Bernie Mac, Alec Baldwin, Sherri Shepherd",United States,6.6,"May 1, 2020"
1964,Maddman: The Steve Madden Story,78,2017,Documentaries,Ben Patterson,Steve Madden,United States,6.6,"January 1, 2018"
1965,Made in China,128,2019,"Comedies, Dramas, International Movies",Mikhil Musale,"Rajkummar Rao, Boman Irani, Mouni Roy, Sumeet Vyas, Paresh Rawal, Gajraj Rao, Manoj Joshi, Sanjay Goradia, Amyra Dastur, Chittaranjan Tripathi, Abhishek Banerjee",India,6.2,"January 12, 2020"
1966,Madness in the Desert,141,2004,"Documentaries, International Movies",Satyajit Bhatkal,"Aamir Khan, Ashutosh Gowariker",India,8.6,"December 22, 2017"
1967,Madras Café,128,2013,"Dramas, International Movies, Thrillers",Shoojit Sircar,"John Abraham, Nargis Fakhri, Rashi Khanna, Avijit Dutt, Prakash Belawadi, Ajay Ratnam, Siddartha Basu, Agnello Dias, Dibang",India,7.7,"July 5, 2020"
1968,Madre,95,2016,"International Movies, Thrillers",Aaron Burns,"Daniela Ramírez, Cristobal Tapia Montt, Aida, Matías Bassi, Nicolás Durán, Ignacia Allamand",Chile,5.6,"August 26, 2017"
1969,Magnetic,110,2018,"Action & Adventure, Documentaries, International Movies",Thierry Donard,"Tom Barrer, Liam Whaley, Wille Lindberg, Sam Favret, Fabian Bodet, Jamie Lee, Lorenzo Avvenenti, Ross Clarke-Jones",France,6.5,"June 12, 2020"
1970,Magnificent,143,2015,"Comedies, International Movies, Romantic Movies",Vikas Bahl,"Shahid Kapoor, Alia Bhatt, Pankaj Kapur, Sanjay Kapoor, Sushma Seth, Niki Walia, Sanah Kapur, Vikas Verma",India,3.6,"April 1, 2020"
1971,Mahabharat,119,2013,"Action & Adventure, Dramas, International Movies",Amaan Khan,"Amitabh Bachchan, Ajay Devgn, Vidya Balan, Shatrughan Sinha, Sunny Deol, Anil Kapoor, Manoj Bajpayee, Jackie Shroff, Anupam Kher, Deepti Naval",India,8.8,"August 1, 2018"
1973,Mahi NRI,134,2017,"Comedies, Dramas, International Movies",Gaurav Bavdankar,"Harrdy Sandhu, Poppy Jabbal, Rameet Kaur, B.N. Sharma, Navneet Nishan, Gurpreet Guggi, Anjum Batra, Ranjan Sehgal",United Kingdom,6.3,"December 1, 2019"
1974,Mahjong Heroes,92,1981,"Comedies, International Movies",Li Pei-Chuan,"Patrick Tse, Betty Ting Pei, Hua Yueh, Chin Siu Ho, Lau Hak-Suen, Kwan Hoi-san",Hong Kong,5.4,"August 16, 2018"
1975,Main Hoon Na,171,2004,"Action & Adventure, Comedies, Dramas",Farah Khan,"Shah Rukh Khan, Sunil Shetty, Sushmita Sen, Zayed Khan, Amrita Rao, Kiron Kher, Boman Irani, Bindu, Naseeruddin Shah, Kabir Bedi",India,7.0,"April 1, 2018"
1976,Main aurr Mrs. Khanna,109,2009,"International Movies, Music & Musicals, Romantic Movies",Prem Soni,"Salman Khan, Kareena Kapoor, Sohail Khan, Preity Zinta, Bappi Lahiri, Yash Tonk, Nauheed Cyrusi, Mahek Chahal",India,3.5,"August 2, 2018"
1977,"Main, Meri Patni Aur Woh",129,2005,"Comedies, International Movies, Romantic Movies",Chandan Arora,"Rajpal Yadav, Rituparna Sengupta, Kay Kay Menon, Varun Bandola, Vinod Nagpal, Naseeruddin Shah",India,7.3,"October 1, 2018"
1978,Maine Pyaar Kyun Kiya,137,2005,"Comedies, International Movies, Music & Musicals",David Dhawan,"Salman Khan, Sushmita Sen, Sohail Khan, Katrina Kaif, Arshad Warsi, Isha Koppikar, Rajpal Yadav, Beena Kak",India,5.5,"December 31, 2019"
1980,Maktub,106,2018,"Comedies, International Movies",Oded Raz,"Guy Amir, Hanan Savyon, Itzik Cohen, Igal Naor",Israel,7.5,"June 15, 2018"
1981,Mala Kahich Problem Nahi,132,2017,"Dramas, International Movies",Sameer Vidwans,"Gashmeer Mahajani, Spruha Joshi, Nirmiti Sawant, Vijay Nikam, Satish Alekar, Mangal Kenkre, Kamlesh Sawant, Seema Deshmukh",India,7.1,"November 15, 2018"
1982,Malaal,133,2019,"Dramas, International Movies, Romantic Movies",Mangesh Hadawale,"Meezaan Jaffrey, Sharmin Segal, Chinmaya Surve, Anil Gawas, Sonal Jha, Sanjay Gurbaxani, Sameer Dharmadhikari, Deepak Damle",India,5.9,"September 26, 2019"
1983,Malang,131,2020,"Action & Adventure, International Movies, Romantic Movies",Mohit Suri,"Anil Kapoor, Aditya Roy Kapur, Disha Patani, Kunal Khemu, Makrand Deshpande, Vatsal Seth, Amruta Khanvilkar, Shaad Randhawa",India,6.5,"May 14, 2020"
1984,Malena Pichot: Estupidez compleja,51,2018,Stand-Up Comedy,"Raúl Campos, Jan Suter",Malena Pichot,Argentina,5.3,"March 2, 2018"
1985,Malevolent,89,2018,"Horror Movies, Thrillers",Olaf de Fleur,"Florence Pugh, Ben Lloyd-Hughes, Celia Imrie, James Cosmo, Scott Chambers, Georgina Bevan",United Kingdom,4.8,"October 5, 2018"
1986,Malibu Rescue,70,2019,"Children & Family Movies, Comedies",Savage Steve Holland,"Ricardo Hurtado, Breanna Yde, Jackie R. Jacobson, Abby Donnelly, Alkoya Brunson, JT Neal, Ian Ziering, Bryana Salaz, Camaron Engels, Jeremy Howard, Jeff Meacham",United States,4.7,"May 13, 2019"
1987,Malicious,91,2018,Horror Movies,Michael Winnick,"Bojana Novakovic, Josh Stewart, Delroy Lindo, Melissa Bolona, Yvette Yates, Luke Edwards, Jaqueline Fleming, Ben VanderMey, Presley Richardson, Joy Kate Lawson",United States,5.0,"February 1, 2019"
1988,Mallesham,131,2019,"Dramas, Independent Movies, International Movies",Raj R,"Jhansi, Priyadarshi Pullikonda, Ananya Nagalla",India,8.5,"November 20, 2019"
1989,Mama's Boy,101,2018,"Comedies, International Movies",Amro Salah,"Hesham Maged, Shikoo, Mohammed Tharwat, Mahmoud Ellisy, Ahmed Sultan, Noor Kadri",Egypt,5.9,"July 10, 2020"
1990,Man of Tai Chi,105,2013,"Action & Adventure, Dramas",Keanu Reeves,"Keanu Reeves, Tiger Chen, Karen Mok, Simon Yam, Qing Ye, Hai Yu, Sam Lee, Iko Uwais","United States, China, Hong Kong",6.1,"July 26, 2018"
1991,Mandi,155,1983,"Dramas, Independent Movies, International Movies",Shyam Benegal,"Shabana Azmi, Smita Patil, Naseeruddin Shah, Amrish Puri, Kulbhushan Kharbanda, Saeed Jaffrey, Om Puri, Sreela Mazumdar, Neena Gupta",India,7.6,"January 1, 2020"
1992,Mandobasar Galpo,103,2017,"Dramas, International Movies, Romantic Movies",Tathagata Banerjee,"Paoli Dam, Parambrata Chattopadhyay, Indrasish Roy, Koushik Sen, Biswajit Chakraborty",India,6.0,"April 1, 2018"
1993,Mango Dreams,92,2016,"Dramas, Independent Movies",John Upchurch,"Ram Gopal Bajaj, Pankaj Tripathi, Sameer Kochhar",United States,7.8,"March 15, 2018"
1994,Manhunt,109,2017,"Action & Adventure, International Movies",John Woo,"Zhang Hanyu, Masaharu Fukuyama, Qi Wei, Ji-won Ha, Jun Kunimura, Angeles Woo, Nanami Sakuraba","China, Hong Kong",5.2,"May 4, 2018"
1995,Manje Bistre,136,2017,"Comedies, Dramas, International Movies",Baljit Singh Deo,"Gippy Grewal, Sonam Bajwa, Karamjit Anmol, Jaggi Singh, B.N. Sharma, Hobby Dhaliwal, Rana Ranbir, Sardar Sohi, Anita Devgan, Harby Sangha",India,6.6,"October 1, 2018"
1996,Manmadhudu 2,152,2019,"Comedies, Dramas, International Movies",Rahul Ravindran,"Nagarjuna Akkineni, Rakul Preet Singh, Lakshmi, Rao Ramesh, Vennela Kishore, Jhansi, Devadarshini Chetan, Nishanti",India,4.8,"September 23, 2019"
1997,Manoranjan,162,1974,"Comedies, International Movies, Music & Musicals",Shammi Kapoor,"Sanjeev Kumar, Zeenat Aman, Shammi Kapoor, Dev Kumar, Madan Puri, Paintal, Asit Kumar Sen, Agha, Murad, Shefali",India,6.8,"September 1, 2017"
1998,Manson Family Vacation,85,2015,"Comedies, Dramas, Independent Movies",J. Davis,"Jay Duplass, Linas Phillips, Leonora Pitts, Adam Chernick, Davie-Blue, Suzanne Ford, Tobin Bell",United States,5.8,"October 27, 2015"
1999,Manto,114,2018,"Dramas, Independent Movies, International Movies",Nandita Das,"Nawazuddin Siddiqui, Rasika Dugal, Tahir Raj Bhasin",India,7.4,"November 30, 2018"
2000,Mantostaan,75,2017,"Dramas, Independent Movies, International Movies",Rahat Kazmi,"Raghuvir Yadav, Veerendra Saxena, Sonal Sehgal, Aaditya Pratap Singh, Rahat Kazmi, Raina Bassnet, Sakshi Bhat",India,6.2,"December 15, 2017"
2001,Mantra,89,2017,"Dramas, Independent Movies, International Movies",Nicholas Kharkongor,"Rajat Kapoor, Lushin Dubey, Kalki Koechlin, Shiv Pandit, Adil Hussain, Rohan Joshi, Yuri Suri, Maya Krishna Rao",India,5.2,"December 15, 2017"
2002,Manu,177,2018,"Dramas, Independent Movies, International Movies",Phanindra Narsetti,"Raja Goutham, Chandini Chowdary, Bomma Sreedhar, John Kottoly, Srikanth Mullagiri, Ravi Teja",India,7.9,"August 1, 2019"
2003,Manusangada,93,2017,"Dramas, Independent Movies, International Movies",Amshan Kumar,"Rajeev Anand, Manimegalai, A.S. Sasi Kumar, Vidhur Rajarajan, Sheela Rajkumar, Sethu Darwin, Anand Sampath, Karuna Prasad",India,8.4,"February 2, 2019"
2004,Maps to the Stars,112,2014,"Comedies, Dramas",David Cronenberg,"Julianne Moore, Mia Wasikowska, Robert Pattinson, John Cusack, Olivia Williams, Sarah Gadon, Evan Bird, Niamh Wilson, Dawn Greenhalgh","Canada, Germany, France, United States",6.2,"December 16, 2018"
2005,Mara,99,2017,"Horror Movies, Thrillers",Clive Tonge,"Olga Kurylenko, Javier Botet, Mitch Eakins, Lance E. Nichols, Rosie Fellner, Mackenzie Imsand, Dandy Barrett, Craig Conway, Melissa Bolona",United States,5.1,"January 5, 2019"
2006,Marc Maron: End Times Fun,71,2020,Stand-Up Comedy,Lynn Shelton,Marc Maron,United States,6.8,"March 10, 2020"
2007,Marc Maron: Thinky Pain,95,2013,Stand-Up Comedy,Lance Bangs,Marc Maron,United States,7.4,"November 1, 2018"
2008,Marc Maron: Too Real,70,2017,Stand-Up Comedy,Lynn Shelton,Marc Maron,United States,7.2,"September 5, 2017"
2009,Marco Luque: Tamo Junto,73,2017,Stand-Up Comedy,Caio Cobra,Marco Luque,Brazil,4.3,"June 15, 2017"
2010,Marco Polo: One Hundred Eyes,29,2015,Movies,Alik Sakharov,"Tom Wu, Benedict Wong, Michelle Yeoh",United States,7.8,"December 26, 2015"
2011,Maria,90,2019,"Action & Adventure, International Movies",Pedring A. Lopez,"Cristine Reyes, Germaine De Leon, KC Montero, Ronnie Lazaro, Freddie Webb",Philippines,5.0,"May 17, 2019"
2012,Maria Bamford: Old Baby,64,2017,Stand-Up Comedy,Jessica Yu,Maria Bamford,United States,6.0,"May 2, 2017"
2013,Maria Bamford: The Special Special Special,50,2012,Stand-Up Comedy,Jordan Brady,"Maria Bamford, Wayne Federman, Jackie Kashian",United States,6.9,"August 25, 2018"
2014,Mariah Carey's Merriest Christmas,38,2015,"Children & Family Movies, Music & Musicals",James Yukich,"Mariah Carey, Lacey Chabert, Kelsey Grammer, Billy Gardell, Fina Strazza, Kenneth Edmonds, Cameron Mathison, Brennan Elliott",United States,4.9,"December 9, 2016"
2016,Marlon Wayans: Woke-ish,67,2018,Stand-Up Comedy,Marcus Raboy,Marlon Wayans,United States,6.5,"February 27, 2018"
2017,Maroon,94,2016,"Dramas, Independent Movies, International Movies",Pulkit,"Manav Kaul, Devyani Cm, Saurabh Sachdeva, Sarika Singh, Suneel Sinha, Sumeet Vyas",India,5.1,"February 1, 2017"
2018,Marriage Palace,135,2018,"Comedies, International Movies",Sunil Thakur,"Sharry Mann, Payal Rajput, Jaswinder Bhalla, B.N. Sharma, Harby Sangha, Nirmal Rishi, Anita Devgan, Rupinder Roopi",India,6.3,"August 23, 2019"
2019,Marriage Story,137,2019,Dramas,Noah Baumbach,"Scarlett Johansson, Adam Driver, Laura Dern, Alan Alda, Ray Liotta, Julie Hagerty, Merritt Wever, Azhy Robertson","United States, United Kingdom",8.0,"December 6, 2019"
2020,Martial Arts of Shaolin,90,1986,"Action & Adventure, International Movies",Chia-Liang Liu,"Jet Li, Jianqiang Hu, Qiuyan Huang, Qingfu Pan, Yu Chenghui, Yu Hai, Jianwen Zhang","Hong Kong, China",6.5,"August 16, 2018"
2021,"Martin Matte: La vie, la mort...eh la la..!",62,2019,Stand-Up Comedy,Jean-François Blais,Martin Matte,Canada,6.5,"October 14, 2019"
2023,Marvel Super Hero Adventures: Frost Fight!,74,2015,"Children & Family Movies, Sci-Fi & Fantasy",Mitch Schauer,"Mick Wingert, Matthew Mercer, Travis Willingham, Fred Tatasciore, Grey DeLisle, Troy Baker, Antony Del Rio, Trevor Devall, Kevin Michael Richardson, Steve Blum, Jane Singer",United States,5.1,"February 24, 2016"
2024,Marvel's Hulk: Where Monsters Dwell,75,2016,"Children & Family Movies, Sci-Fi & Fantasy",Mitch Schauer,"Fred Tatasciore, Liam O'Brien, Jesse Burch, Edward Bosco, Chiara Zanni, Mike Vaughn, Jon Olson, Matthew Waterson, Zach Callison, Laura Bailey, Hope Levy",United States,5.5,"January 4, 2017"
2025,Mary Kom,120,2014,"Dramas, International Movies, Sports Movies",Omung Kumar,"Priyanka Chopra, Darshan Kumar, Sunil Thapa, Kenny Basumatary, Shishir Sharma, Robin Das, Rajni Basumatary, Lin Laishram, Shakti Singh",India,6.8,"July 5, 2020"
2026,Mary Poppins Returns,131,2018,"Children & Family Movies, Music & Musicals",Rob Marshall,"Emily Blunt, Lin-Manuel Miranda, Ben Whishaw, Emily Mortimer, Pixie Davies, Nathanael Saleh, Joel Dawson, Julie Walters, Meryl Streep, Colin Firth, Dick Van Dyke","United States, United Kingdom",6.7,"July 9, 2019"
2027,Mary and the Witch's Flower,103,2017,"Anime Features, Children & Family Movies",Hiromasa Yonebayashi,"Ruby Barnhill, Kate Winslet, Jim Broadbent, Ewen Bremner, Lynda Baron, Louis Ashbourne Serkis, Morwenna Banks, Teresa Gallagher, Rasmus Hardiker",Japan,6.8,"July 17, 2018"
2028,Masameer - The Movie,100,2020,"Comedies, International Movies",Malik Nejer,"Malik Nejer, Shahad Alahmari, Abdulaziz Almuzaini, Yousef Aldakheel",Saudi Arabia,6.0,"March 19, 2020"
2029,Mascots,95,2016,Comedies,Christopher Guest,"Carrie Aizley, Sarah Baker, Bob Balaban, Ed Begley Jr., Tom Bennett, Maria Blasucci, Jennifer Coolidge, Kerry Godliman, Matt Griesser, Christopher Guest, John Michael Higgins, Michael Hitchcock, Don Lake, Jane Lynch, Christopher Moynihan, Chris O'Dowd, Jim Piddock, Parker Posey, Harry Shearer, Fred Willard, Zach Woods, Susan Yeagley",United States,5.7,"October 13, 2016"
2030,Maska,112,2020,"Comedies, Dramas, International Movies",Neeraj Udhwani,"Manisha Koirala, Prit Kamani, Shirley Setia, Nikita Dutta, Javed Jaffrey, Dhruv Lohumi",India,5.9,"March 27, 2020"
2031,Masoom,138,1983,"Dramas, Independent Movies, International Movies",Shekhar Kapur,"Shabana Azmi, Naseeruddin Shah, Saeed Jaffrey, Jugal Hansraj, Urmila Matondkar, Aradhana Srivastav, Tanuja, Supriya Pathak",India,8.5,"December 31, 2019"
2032,Master Z: The Ip Man Legacy,108,2018,"Action & Adventure, International Movies",Yuen Woo-ping,"Zhang Jin, Dave Bautista, Michelle Yeoh, Tony Jaa, Liu Yan, Kevin Cheng, Chrissie Chow, Xing Yu","Hong Kong, China",6.5,"October 23, 2019"
2033,Mater,80,2017,"Dramas, Independent Movies, International Movies",Pablo D'Alo Abba,"Lautaro Perotti, Tamara Kiper, Inda Lavalle, Miriam Odorico, Araceli Dvoskin, Gonzalo Ruiz, Patricio Aranguren, Marina Bellati, Luciana Fuks, Martin Slipak",Argentina,4.6,"August 1, 2018"
2034,Material,94,2012,"Comedies, Dramas, International Movies",Craig Freimond,"Vincent Ebrahim, Riaad Moosa, Joey Rasdien, Denise Newman, Krijay Govender, Nik Rabinowitz, Zakeeya Patel, Carishma Basday, Royston Stoffels, Mel Miller",South Africa,7.4,"May 1, 2020"
2036,Mauli,136,2018,"Action & Adventure, Dramas, International Movies",Aditya Sarpotdar,"Riteish Deshmukh, Saiyami Kher, Jitendra Joshi, Siddarth Jadhav, Shrikant Yadav, Vijay Nikam, Umesh Jagtap, Usha Naik, Girija Oak, Genelia D'Souza",India,6.0,"July 17, 2019"
2037,Maurício Meirelles: Generating Chaos,63,2020,Stand-Up Comedy,Diego Pignataro,Maurício Meirelles,Brazil,6.6,"April 16, 2020"
2038,May We Chat,99,2014,"Dramas, International Movies",Philip Yung,"Irene Wan, Peter Mak, Rainky Wai, Heidi Lee, Kabby Hui, Paulyn Sun, Dominic Ho, Au Cheuk-Man",Hong Kong,5.0,"August 26, 2018"
2039,May You Prosper,93,2017,"Comedies, International Movies, Music & Musicals","Hassan Hegazy, Shady Ali","Ahmed Rizk, Bosy, Bayoumi Fouad, Mahmoud Ellithy, Hayatem, Hesham Ismail, Tamer Shaltout, Alaa Morsy",Egypt,3.7,"July 20, 2019"
2040,May the Devil Take You,111,2018,"Horror Movies, International Movies",Timo Tjahjanto,"Chelsea Islan, Pevita Pearce, Samo Rafael, Karina Suwandhi, Ray Sahetapy, Ruth Marini, Hadijah Shahab, Clara Bernadeth, Kinaryosih, Nicole Rossi",Indonesia,6.0,"November 15, 2018"
2041,Maya Memsaab,122,1993,"Dramas, International Movies, Music & Musicals",Ketan Mehta,"Deepa Sahi, Farooq Shaikh, Raj Babbar, Shah Rukh Khan, Shreeram Lagoo, Sudha Shivpuri, Paresh Rawal, Raghuvir Yadav, Satyadev Dubey","France, United Kingdom, India",5.3,"June 1, 2017"
2042,Mayday Life,120,2019,"International Movies, Music & Musicals",Muh Chen,"Mayday, Huang Bo, Tony Leung Ka-fai","China, Taiwan",7.7,"August 23, 2019"
2044,Me and the Alien,83,2016,"Comedies, Dramas, International Movies",Jesús Magaña Vázquez,"Ines De Tavira, Juan Pablo Campa, Paco de la Fuente, Juan Ugarte, Carlos Aragón, Gloria Toba, Jessy Bulbo, Tato Alexander, Fabiola Guajardo, Arturo Carmona",Mexico,5.6,"February 14, 2017"
2045,Mea Culpa,54,2017,Stand-Up Comedy,"Raúl Campos, Jan Suter",Alexis de Anda,Mexico,4.8,"November 10, 2017"
2046,Mean Dreams,105,2016,"Dramas, Independent Movies, Thrillers",Nathan Morlando,"Bill Paxton, Sophie Nélisse, Josh Wiggins, Colm Feore, Vickie Papavs, Joe Cobden, Ryan Blakely, George Buza",Canada,6.3,"July 1, 2019"
2047,Mean Streets,112,1973,"Classic Movies, Dramas, Independent Movies",Martin Scorsese,"Robert De Niro, Harvey Keitel, David Proval, Amy Robinson, Richard Romanus, Cesare Danova, Victor Argo, George Memmoli",United States,7.3,"July 1, 2020"
2048,Medium,90,1985,"Horror Movies, International Movies, Thrillers",Jacek Koprowicz,"Władysław Kowalski, Michał Bajor, Jerzy Zelnik, Jerzy Stuhr, Grażyna Szapołowska, Jerzy Nowak, Ewa Dałkowska, Piotr Machalica, Zygmunt Zintel, Henryk Bista","Poland, West Germany",6.5,"October 1, 2019"
2050,Meghnadbodh Rohoshyo,150,2017,"Dramas, International Movies",Anik Datta,"Barun Chanda, Sabyasachi Chakraborty",India,6.3,"October 15, 2018"
2051,Mehandi Circus,126,2019,"Dramas, International Movies, Romantic Movies",Saravana Rajendran,"Madhampatti Rangaraj, Shweta Tripathi, Vela Ramamoorthy, Ankur Vikal, G. Marimuthu, Sunny Charles",India,7.5,"October 30, 2019"
2052,Melle,110,2017,"Dramas, International Movies, Romantic Movies",Binu Ulahhannan,"Amith Chakalakkal, Thanuja Karthik, Joy Mathew, Joju George, Krishna Prabha, Ambika Mohan, P. Balachandran, Illikkett Namboothiri",India,6.3,"August 1, 2018"
2053,Melvin Goes to Dinner,84,2003,"Comedies, Dramas, Independent Movies",Bob Odenkirk,"Michael Blieden, Stephanie Courtney, Annabelle Gurwitch, Matt Price, David Cross, Maura Tierney, Kathleen Roll, Jack Black, Jenna Fischer, Fred Armisen",United States,6.8,"July 1, 2018"
2055,Menahi,101,2008,"Comedies, International Movies",Ayman Makram,"Fayez Al-Malki, Mona Wasef, Abdel Imam Abdullah, Reem Abdel Aziz, Dana Jabr, Emad Al Youssef, Remas Mansoor, Khalid Mengah",Saudi Arabia,6.0,"June 11, 2020"
2056,Menashe,82,2017,"Dramas, Independent Movies","Josh Z. Weinstein, Joshua Z. Weinstein","Menashe Lustig, Ruben Niborski, Yoel Weisshaus, Meyer Schwartz, Yoel Falkowitz, Ariel Vaysman",United States,6.5,"January 25, 2020"
2057,Menorca,81,2016,"Dramas, Independent Movies",John Barnard,"Tammy Gillis, Sheila Campbell, Talia Pura, Dorothy Carroll, Logan Creran, Jason Wishnowski, Aaron Merke, Krystle Snow, Michael O'Sullivan","Canada, Spain",4.4,"August 27, 2017"
2058,Merata: How Mum Decolonised the Screen,88,2018,Documentaries,Hepi Mita,Hepi Mita,New Zealand,6.8,"May 12, 2019"
2059,Mercenary,99,2016,"Dramas, International Movies, Sports Movies",Sacha Wolff,"Toki Pilioko, Iliana Zabeth, Mikaele Tuugahala, Laurent Pakihivatau, Petelo Sealeu, Maoni Talalua, Teotola Maka, Bessarion Udesiani",France,6.4,"December 4, 2016"
2061,Mercy,88,2016,"Dramas, Thrillers",Chris Sparling,"James Wolk, Caitlin Fitzgerald, Tom Lipinski, Dan Ziskie, Michael Godere, Michael Donovan, Dion Graham, Constance Barron",United States,4.2,"November 22, 2016"
2062,Mercy Black,88,2019,Horror Movies,Owen Egerton,"Daniella Pineda, Elle LaMont, Janeane Garofalo, Miles Emmons, Lee Eddy, Austin Amelio, Elke Boucher-Depew, Dylan Gage, Troy Anthony Hogan, Jamy Lentz",United States,4.9,"March 31, 2019"
2063,Mere Pyare Prime Minister,103,2019,"Dramas, International Movies",Rakeysh Omprakash Mehra,"Anjali Patil, Om Kanojiya, Niteesh Wadhwa, Makrand Deshpande, Syna Anand, Prasad, Adarsh, Rasika Agashe",India,6.8,"May 31, 2019"
2064,Merku Thodarchi Malai,115,2018,"Dramas, Independent Movies, International Movies",Lenin Bharathi,"Antony, Gayathri Krishna, Abu Valayamkulam, Anthony Vaathiyaar, Aarubala, Sornam",India,8.6,"January 1, 2019"
2066,Merry Men: The Real Yoruba Demons,106,2018,"Comedies, International Movies",Toka McBaror,"Ramsey Nouah, Jim Iyke, Ayo Makun, Falz, Richard Mofe-Damijo, Iretiola Doyle, Damilola Adegbite, Rosaline Meurer, Jide Kosoko, Ali Nuhu, Segun Arinze, Francis Duru",Nigeria,6.1,"September 21, 2019"
2067,Mersal,162,2017,"Action & Adventure, Dramas, International Movies",Atlee Kumar,"Joseph Vijay, S.J. Surya, Kajal Aggarwal, Samantha Ruth Prabhu, Nithya Menon, Vadivelu, Sathyaraj",India,7.7,"August 21, 2018"
2068,Message from the King,103,2017,"Independent Movies, Thrillers",Fabrice Du Welz,"Chadwick Boseman, Luke Evans, Teresa Palmer, Alfred Molina, Natalie Martinez, Tom Felton, Dale Dickey, Sibongile Mlambo","United Kingdom, France, Belgium, United States",6.4,"August 4, 2017"
2069,Metro,116,2016,"Dramas, International Movies, Thrillers",Ananda Krishnan,"Yogi Babu, Bobby Simha, Shirish",India,7.3,"April 1, 2018"
2071,Mi Obra Maestra,105,2018,"Comedies, International Movies",Gastón Duprat,"Guillermo Francella, Luis Brandoni, Raúl Arévalo, Andrea Frigerio, María Soldi, Mónica Duprat, Mahmoud Azim, Santiago Korovsky, Julio Marticorena, Alejandro Paker","Argentina, Spain",7.1,"January 25, 2019"
2072,Mi amigo Alexis,102,2019,"Children & Family Movies, Comedies, Dramas",Alejandro Fernández Almendras,"Luciano González, Alexis Sánchez, Daniel Muñoz, Ignacia Uribe, Marco Baeza, Manuela Oyarzún, Camilo Carmona, Alejandra Yañez, Lorna Campos, Gustavo Becerra",Chile,4.9,"August 30, 2019"
2073,Michael,86,2011,"Dramas, Independent Movies, International Movies",Ribhu Dasgupta,"Naseeruddin Shah, Mahie Gill, Sabyasachi Chakraborty, Rudranil Ghosh, Iravati Harshe, Churni Ganguly, June Maliah, Purav Bhandare, Shridhar Watsar",India,5.3,"July 5, 2020"
2074,"Michael Bolton's Big, Sexy Valentine's Day Special",54,2017,"Comedies, Music & Musicals, Romantic Movies","Scott Aukerman, Akiva Schaffer","Michael Bolton, Andy Samberg, Will Forte, Kenny G, Maya Rudolph, Adam Scott, Janeane Garofalo, Brooke Shields, Sinbad, Michael Sheen, Tim Robinson, Bob Saget, Mary Holland, Andy Richter, Colton Dunn, David Theune, Randall Park, Sarah Silverman, Mary Sohn, Fred Armisen, Matthew Kimbrough, Maya Erskine, Louie Anderson, Claudia O'Doherty, Kate Berlant, Baron Vaughn, Zachary Oyama, Casey Wilson, Sarah Shahi, Jimmy Graham, Luka Jones, Akiva Schaffer, Eric André, Scott Aukerman, Nicole Byer, Dave Ferguson, Tim Kalpakis, Mike Hanford, Mircea Monroe, Chris Parnell, Sal Stowers",United States,6.7,"February 7, 2017"
2075,Michael Che Matters,61,2016,Stand-Up Comedy,Oz Rodriguez,Michael Che,United States,7.1,"November 25, 2016"
2077,Michelle Wolf: Joke Show,60,2019,Stand-Up Comedy,Lance Bangs,Michelle Wolf,United States,7.1,"December 10, 2019"
2078,Middle Men,113,2009,"Comedies, Dramas, Independent Movies",George Gallo,"Luke Wilson, Giovanni Ribisi, Gabriel Macht, James Caan, Jacinda Barrett, Kevin Pollak, Laura Ramsey, Rade Serbedzija, Terry Crews, Kelsey Grammer",United States,6.8,"June 10, 2020"
2079,Middle School: The Worst Years of My Life,92,2016,"Children & Family Movies, Comedies",Steve Carr,"Griffin Gluck, Lauren Graham, Rob Riggle, Thomas Barbusca, Andrew Daly, Adam Pally, Retta, Efren Ramirez, Isabela Moner, Alexa Nisenson, Jacob Hopkins","United States, Cambodia",6.1,"March 3, 2019"
2081,Mike Birbiglia: My Girlfriend's Boyfriend,76,2013,Stand-Up Comedy,Seth Barrish,Mike Birbiglia,United States,8.0,"May 2, 2020"
2082,Mike Birbiglia: Thank God for Jokes,71,2017,Stand-Up Comedy,"Seth Barrish, Mike Birbiglia",Mike Birbiglia,United States,7.5,"February 28, 2017"
2083,Mike Birbiglia: The New One,86,2019,Stand-Up Comedy,Seth Barrish,Mike Birbiglia,United States,7.7,"November 26, 2019"
2085,Mike Epps: Don't Take It Personal,60,2015,Stand-Up Comedy,L. Frazier,Mike Epps,United States,4.3,"December 18, 2015"
