id,movie_name,Duration,year,genre,director,actors,country,rating,enter_in_netflix
1029,Escape from Mr. Lemoncello’s Library,69,2017,Children & Family Movies,Scott McAboy,"Casey Simpson, Breanna Yde, Klarke Pipkin, Angel Luis Rivera Jr., Russell Roberts, Ty Consiglio, Hayley Scherpenisse, Patti Allan, Katey Hoffman",United States,5.3,"November 2, 2019"
1030,"Escape from the ""Liberty"" Cinema",88,1990,"Comedies, Dramas, Independent Movies",Wojciech Marczewski,"Janusz Gajos, Zbigniew Zamachowski, Teresa Marczewska, Piotr Fronczewski, Władysław Kowalski, Michał Bajor, Jan Peszek, Jerzy Bińczycki",Poland,7.2,"October 1, 2019"
1031,Escaping Tel Aviv,120,2009,"Action & Adventure, International Movies",Sherif Arafa,"Karim Abdel Aziz, Mona Zaki, Sherif Mounir, Entsar, Salem Klass, Sabri Abdulmonem, Kinda Alloush, Yasser Ali Maher, Kamal Suliman, Jerjes Jbara",Egypt,7.3,"May 19, 2020"
1032,Esperando La Carroza,95,1985,"Comedies, Cult Movies, International Movies",Alejandro Doria,"Luis Brandoni, China Zorrilla, Antonio Gasalla, Julio De Grazia, Betiana Blum, Monica Villa, Juan Manuel Tenuta, Andrea Tenuta, Cecilia Rossetto, Enrique Pinti",Argentina,8.1,"July 15, 2018"
1033,Euphoria,110,2018,"Dramas, International Movies, LGBTQ Movies",Valeria Golino,"Riccardo Scamarcio, Valerio Mastandrea, Isabella Ferrari, Valentina Cervi, Jasmine Trinca, Andrea Germani, Marzia Ubaldi, Iaia Forte",Italy,6.5,"November 1, 2019"
1037,Even the Rain,103,2010,"Dramas, International Movies",Icíar Bollaín,"Luis Tosar, Gael García Bernal, Juan Carlos Aduviri, Karra Elejalde, Raúl Arévalo, Carlos Santos, Cassandra Ciangherotti, Milena Soliz, Leónidas Chiri, Vicente Romero, Daniel Currás, Pau Cólera","Spain, Mexico, France",7.4,"May 17, 2011"
1038,Evening Shadows,102,2018,"Dramas, Independent Movies, International Movies",Sridhar Rangayan,"Mona Ambegaonkar, Anant Mahadevan, Devansh Doshi, Arpit Chaudhary, Yamini Singh, Abhay Kulkarni, Veena Nair, Disha Thakur",India,7.2,"February 27, 2019"
1039,Every Time I Die,98,2019,"Dramas, Independent Movies, Thrillers",Robi Michael,"Drew Fonteiro, Marc Menchaca, Michelle Macedo, Tyler Fleming, Melissa Macedo, Kenneth Moronta, Frankie Hinton",United States,5.1,"February 25, 2020"
1040,Everybody Knows,133,2019,"Dramas, International Movies, Thrillers",Asghar Farhadi,"Penélope Cruz, Javier Bardem, Ricardo Darín, Eduard Fernández, Bárbara Lennie, Inma Cuesta, Elvira Mínguez, Ramón Barea, Carla Campra, Sara Sálamo, Roger Casamajor, José Ángel Egido","Spain, France, Italy",6.9,"June 6, 2019"
1041,Everyday I Love You,124,2015,"International Movies, Romantic Movies",Mae Czarina Cruz,"Enrique Gil, Liza Soberano, Gerald Anderson, Aiko Melendez, Carmina Villaroel, Ariel Rivera, Marissa Delgado, Liza Lorena",Philippines,7.0,"March 4, 2019"
1042,Everything About Her,127,2016,"Comedies, Dramas, International Movies",Joyce Bernal,"Angel Locsin, Xian Lim, Vilma Santos, Michael De Mesa, Nonie Buencamino, Khalil Ramos, Devon Seron, Alexa Ilacad, Nor Domingo, Robert Villar",Philippines,7.2,"March 14, 2019"
1043,Evvarikee Cheppoddu,134,2019,"Comedies, International Movies, Romantic Movies",Basava Shankar Eeday,"Rakesh Varre, Gargeyi, Vamsi raj Nekkanti, D P Ghani, K Prasanna",India,7.3,"November 27, 2019"
1044,Ex Machina,108,2015,"Dramas, Independent Movies, International Movies",Alex Garland,"Domhnall Gleeson, Alicia Vikander, Oscar Isaac, Sonoya Mizuno, Claire Selby, Symara Templeman, Gana Bayarsaikhan, Tiffany Pisani, Corey Johnson, Evie Wray, Deborah Rosan",United Kingdom,7.7,"July 26, 2018"
1046,Expedition Happiness,96,2017,"Documentaries, International Movies",Selima Taibi,"Selima Taibi, Felix Starck",Germany,5.9,"January 31, 2018"
1047,Expelled from Paradise,103,2014,"Action & Adventure, Anime Features, Sci-Fi & Fantasy",Seiji Mizushima,"Rie Kugimiya, Wendee Lee, Shinichiro Miki, Steve Blum, Hiroshi Kamiya, Johnny Yong Bosch",Japan,6.7,"June 25, 2018"
1048,Extinction,95,2018,"Action & Adventure, Dramas, Sci-Fi & Fantasy",Ben Young,"Michael Peña, Lizzy Caplan, Israel Broussard, Mike Colter, Emma Booth, Lex Shrapnel, Erica Tremblay, Lilly Aspell",United States,5.8,"July 27, 2018"
1049,Extraction,117,2020,Action & Adventure,Sam Hargrave,"Chris Hemsworth, Rudhraksh Jaiswal, Randeep Hooda, Golshifteh Farahani, Pankaj Tripathi, David Harbour",United States,6.7,"April 24, 2020"
1050,"Extremely Wicked, Shockingly Evil and Vile",110,2019,"Dramas, Independent Movies",Joe Berlinger,"Zac Efron, Lily Collins, Kaya Scodelario, Jeffrey Donovan, Angela Sarafyan, Jim Parsons, John Malkovich, Haley Joel Osment, Dylan Baker, Brian Geraghty",United States,6.6,"May 3, 2019"
1052,Eye For An Eye,108,2019,"Dramas, International Movies, Thrillers",Paco Plaza,"Luis Tosar, Xan Cejudo, Ismael Martínez, Enric Auquer, María Vázquez, Daniel Currás, Rebeca Montero, Luisa Mayol, Jessica Serna, Tamara Canosa",Spain,6.6,"January 15, 2020"
1053,Eyyvah Eyyvah,99,2010,"Comedies, International Movies",Hakan Algül,"Demet Akbağ, Ata Demirer, Özge Borak, Bican Günalan, Salih Kalyon, Tanju Tuncel, Meray Ülgen",Turkey,7.0,"March 10, 2017"
1054,Eyyvah Eyyvah 2,106,2011,"Comedies, International Movies, Romantic Movies",Hakan Algül,"Demet Akbağ, Ata Demirer, Özge Borak, Salih Kalyon, Tanju Tuncel, Meray Ülgen, Bican Günalan, Tarık Ünlüoğlu, Ayşenil Şamlıoğlu",Turkey,6.6,"March 10, 2017"
1055,Eyyvah Eyyvah 3,103,2014,"Comedies, International Movies",Hakan Algül,"Demet Akbağ, Ata Demirer, Özge Borak, Salih Kalyon, Tanju Tuncel, Serra Yılmaz, Tarık Ünlüoğlu, Ayşenil Şamlıoğlu",Turkey,6.0,"March 10, 2017"
1056,F.R.E.D.I.,90,2018,"Children & Family Movies, Sci-Fi & Fantasy",Sean Olson,"Kelly Hu, Angus Macfadyen, Candace Cameron Bure, Lucius Hoyos, Reid Miller, Tyler Christopher, Casimere Jollette, Christina Cox, Texas Battle, Harvey Guillen",United States,5.0,"December 15, 2018"
1058,Fabrizio Copano: Solo pienso en mi,60,2017,Stand-Up Comedy,"Rodrigo Toro, Francisco Schultz",Fabrizio Copano,Chile,4.8,"September 8, 2017"
1059,Fadily Camara : La plus drôle de tes copines,54,2019,Stand-Up Comedy,Gautier & Leduc,Fadily Camara,France,5.4,"November 14, 2019"
1060,Failure to Launch,97,2006,"Comedies, Romantic Movies",Tom Dey,"Matthew McConaughey, Sarah Jessica Parker, Zooey Deschanel, Justin Bartha, Bradley Cooper, Terry Bradshaw, Kathy Bates, Tyrel Jackson Williams, Katheryn Winnick",United States,5.6,"March 1, 2020"
1061,"Faith, Hope & Love",106,2019,"Comedies, Faith & Spirituality, Romantic Movies",Robert Krantz,"Robert Krantz, Peta Murgatroyd, Corbin Bernsen, Michael Richards, Nancy Stafford",United States,6.2,"February 4, 2020"
1062,Fakkah Fuzz: Almost Banned,61,2018,Stand-Up Comedy,Michael McKay,Fakkah Fuzz,Singapore,4.0,"January 26, 2018"
1063,Fall Girls,80,2019,Comedies,Chris Stokes,"Amara La Negra, Erica Hubbard, Joely Fisher, Paris Phillips, Erica Peeples, Tami Roman, Alfred Thomas II, J-Boog, Hunter Ives, Dylan Mooney",United States,3.9,"January 1, 2020"
1064,Falling Inn Love,98,2019,"Comedies, Romantic Movies",Roger Kumble,"Christina Milian, Adam Demos, Jeffrey Bowyer-Chapman, Anna Jullienne, Claire Chitham, Blair Strang, Jonathan Martin, William Walker, Daniel Watterson, Simone Walker",United States,5.6,"August 29, 2019"
1066,Familiye,99,2017,"Dramas, Independent Movies, International Movies","Sedat Kirtan, Kubilay Sarikaya","Kubilay Sarikaya, Arnel Taci, Muhammed Kirtan, Violetta Schurawlow, Burak Yiğit, Giwar Xatar Hajabi, Ridvan Kirtan, Ilhan Erdinc, Michael Hanemann, Sedat Kirtan",Germany,6.5,"May 1, 2019"
1067,Family Blood,92,2018,Horror Movies,Sonny Mallhi,"James Ransone, Vinessa Shaw, Ajiona Alexus, Colin Ford",United States,4.2,"May 5, 2018"
1068,Fan of Amoory,109,2018,"Children & Family Movies, Dramas, International Movies",Salmeen AlMurry Amer,"AlMulla AbdulRahman, Mansour Al Felei, Abdullah Bin Heider, Alhamadi Hamad, Alzaabi Matar, AlBloushi Mayed, Althogali Saif, Alaa Shakir",United Arab Emirates,5.8,"May 14, 2020"
1069,Fanatic,91,2019,Thrillers,Keith L. Smith,"Denyce Lawton, Hosea Chanchez, Michelle Mitchenor, Darius McCrary, Shawne Merriman, Sticky Fingaz, Miguel A. Núñez Jr., Masika Kalysha, Zac Titus",United States,2.9,"August 24, 2019"
1070,Fanatyk,33,2017,"Comedies, Dramas, Independent Movies",Michał Tylka,"Piotr Cyrwus, Mikołaj Kubacki, Anna Radwan, Marian Dziędziel, Jan Nowicki, Juliusz Chrząstowski, Małgorzata Krzysica, Jacek Strama",Poland,6.6,"February 14, 2020"
1071,Faraar,146,2015,"Action & Adventure, Dramas, International Movies",Baljit Singh Deo,"Kainaat Arora, Jaggi Singh, Gippy Grewal",Australia,5.4,"December 1, 2018"
1072,Farce,94,2017,"Comedies, International Movies",Shadi Ali,"Ahmed Fathy, Bayoumi Fouad, Sami Maghouri, Mohammed Tharwat, Mohamed Salam, Haya Ibrahim, Mohsen Mansour",Egypt,5.2,"June 6, 2019"
1073,Fary Is the New Black,75,2018,Stand-Up Comedy,Kader Aoun,Fary,France,5.9,"April 3, 2018"
1074,Fashion,158,2008,"Dramas, International Movies",Madhur Bhandarkar,"Priyanka Chopra, Kangana Ranaut, Mugdha Godse, Arbaaz Khan, Arjan Bajwa, Raj Babbar, Kiran Juneja, Samir Soni",India,6.9,"August 2, 2018"
1075,Fat Ballerina - David A. Arnold,61,2020,Stand-Up Comedy,Milton Horowitz,David A. Arnold,United States,7.5,"March 2, 2020"
1077,Fatso,97,2012,"Comedies, Dramas, International Movies",Rajat Kapoor,"Ranvir Shorey, Gul Panag, Purab Kohli, Neil Bhoopalam, Gunjan Bakshi, Saurabh Shukla, Atul Kumar, Brijendra Kala, Bharati Achrekar, Rahul Vohra",India,5.7,"February 15, 2019"
1078,Feel Rich,70,2017,Documentaries,Peter Spirer,"Quincy Jones, Common, Russell Simmons, Fat Joe, Paul Wall, Quincy Jones III",United States,6.4,"August 23, 2017"
1079,Feel the Beat,110,2020,"Children & Family Movies, Comedies, Dramas",Elissa Down,"Sofia Carson, Wolfgang Novogratz, Donna Lynne Champlin, Eva Hauge, Rex Lee, Brandon Kyle Goodman, Lidya Jewett, Sadie Lapidus, Johanna Colón, Shaylee Mansfield, Shiloh Nelson, Justin Allan, Carina Battrick, Kai Zen, Marissa Jaret Winokur, Enrico Colantoni, Dennis Andres",United States,6.4,"June 19, 2020"
1080,Felipe Esparza: They're Not Going to Laugh at You,58,2012,Stand-Up Comedy,Scott L. Montoya,Felipe Esparza,United States,6.6,"July 3, 2018"
1081,Felipe Neto: My Life Makes No Sense,91,2017,Stand-Up Comedy,Diego Pignataro,Felipe Neto,Brazil,4.4,"March 24, 2017"
1083,Feo pero sabroso,91,2018,"Comedies, International Movies",Fernando Ayllón,"Iván Marín, Lina Cardona, Carlos Barbosa, Ana Cristina Botero, Karine Amaya, Fabiola Posada, Nelson Polanía, Andrea Carvajal, Rocío Tavera, Alberto Saavedra, Christian López, Jorge Herrera, Ricardo Quevedo",Colombia,4.3,"August 30, 2019"
1084,Fernando Sanjiao: Hombre,63,2018,Stand-Up Comedy,"Raúl Campos, Jan Suter",Fernando Sanjiao,Argentina,6.3,"May 25, 2018"
1085,Ferrari Ki Sawaari,133,2012,"Comedies, International Movies, Sports Movies",Rajesh Mapuskar,"Sharman Joshi, Boman Irani, Ritwik Sahore, Paresh Rawal, Deepak Shirke, Satyadeep Misra, Aakash Dabhade, Nilesh Diwekar, Vidya Balan",India,6.4,"August 1, 2019"
1086,Fiddler on the Roof,181,1971,"Classic Movies, Dramas, Music & Musicals",Norman Jewison,"Topol, Norma Crane, Leonard Frey, Molly Picon, Paul Mann, Rosalind Harris, Michele Marsh, Neva Small, Paul Michael Glaser, Ray Lovelock",United States,8.0,"July 1, 2020"
1087,Fifty,101,2015,"Dramas, International Movies",Biyi Bandele,"Dakore Akande, Ireti Doyle, Nse Ikpe-Etim, Omoni Oboli",Nigeria,6.0,"December 28, 2015"
1089,Filmworker,94,2017,Documentaries,Tony Zierra,Leon Vitali,United States,7.4,"November 1, 2018"
1090,Filosofi Kopi The Movie,118,2015,"Dramas, International Movies",Angga Dwimas Sasongko,"Chicco Jerikho, Rio Dewanto, Julie Estelle, Jajang C. Noer, Slamet Rahardjo, Otig Pakis, Arash Buana, Hazel Raditya, Dimas Harya, Westny Dj",Indonesia,7.1,"October 11, 2018"
1091,Finally Found Someone,125,2017,"International Movies, Romantic Movies",Theodore Boborol,"John Lloyd Cruz, Sarah Geronimo, Enchong Dee, Christian Bables, Joey Marquez, Yayo Aguila, Tetchie Agbayani, Dennis Padilla, Leo Rialp, Alwyn Uytingco",Philippines,5.7,"March 14, 2019"
1093,Fire in the Blood,83,2012,"Documentaries, International Movies",Dylan Mohan Gray,William Hurt,India,7.7,"May 13, 2020"
1094,Firebrand,117,2019,"Dramas, International Movies",Aruna Raje,"Usha Jadhav, Girish Kulkarni, Sachin Khedekar, Rajeshwari Sachdev, Rushad Rana, Mrunal Oak",India,5.1,"February 22, 2019"
1095,Fireflies,99,2013,"Dramas, Independent Movies, International Movies",Sabal Singh Shekawat,"Rahul Khanna, Arjun Mathur, Shivani Ghai, Monica Dogra, Aadya Bedi",India,6.4,"April 24, 2019"
1098,Fireworks,91,2017,"Anime Features, Romantic Movies","Akiyuki Shinbo, Nobuyuki Takeuchi","Yuki Kaji, Nobuo Tobita, Michiko Neya, Mitsuru Miyamoto, Fumihiko Tachiki, Shintaro Asanuma, Takahiro Sakurai, Kana Hanazawa, Toshiyuki Toyonaga, Suzu Hirose, Shinichiro Miki, Mamoru Miyano, Takako Matsu, Masaki Suda",Japan,5.5,"December 25, 2019"
1099,First Impression,96,2018,"Comedies, Romantic Movies",Arthur Muhammad,"Lamman Rucker, Lisa Arrindell Anderson, Elise Neal, Kendrick Cross",United States,6.2,"May 17, 2019"
1100,First Kill,102,2017,Action & Adventure,Steven C. Miller,"Hayden Christensen, Bruce Willis, Gethin Anthony, Megan Leonard, Tyler Jon Olson, Shea Buckner, William DeMeo, Magi Avila, Ty Shelton, Christine Dye","United Kingdom, Canada, United States",5.0,"September 1, 2019"
1101,First Kiss,90,2018,"Dramas, International Movies, Romantic Movies",Roy Poortmans,"Vajèn van den Bosch, Buddy Vedder, Leontine Borsato, Caroline de Bruijn, Stijn Fransen, Marije Zuurveld",Netherlands,4.4,"October 1, 2019"
1102,First Match,103,2018,"Dramas, Independent Movies, Sports Movies",Olivia Newman,"Elvire Emanuelle, Yahya Abdul-Mateen II, Colman Domingo, Jharrel Jerome, Kim Ramirez, Jared Kemp, Allen Maldonado",United States,6.3,"March 30, 2018"
1103,First They Killed My Father,137,2017,Dramas,Angelina Jolie,"Sreymoch Sareum, Kompheak Phoeung, Socheata Sveng, Dara Heng, Sothea Khoun, Sreyneang Oun, Kimhak Mun, Chenda Run, Nika Sarun, Nita Sarun","Cambodia, United States",7.2,"September 15, 2017"
1104,Fishtail,61,2015,Documentaries,Andrew Renzi,Harry Dean Stanton,United States,6.6,"October 1, 2018"
1105,Fishtronaut: The Movie,78,2018,Children & Family Movies,"Célia Catunda, Kiko Mistrorigo, Rodrigo Eba","Fábio Lucindo, Celso Alves, Fernanda Bullara",Brazil,5.5,"April 25, 2018"
1106,Fitoor,124,2016,"Dramas, International Movies, Romantic Movies",Abhishek Kapoor,"Aditya Roy Kapoor, Katrina Kaif, Tabu, Rahul Bhatt, Lara Dutta, Akshay Oberoi, Aditi Rao Hydari, Ajay Devgn",India,5.4,"August 2, 2018"
1108,Five Elements Ninjas,104,1982,"Action & Adventure, International Movies",Cheh Chang,"Tien-chi Cheng, Tien Hsiang Lung, Meng Lo, Michael Chan Wai-Man, Pei Hsi Chen, Li Wang, Ke Chu",Hong Kong,7.3,"September 17, 2019"
1109,Five Nights in Maine,83,2015,"Dramas, Independent Movies",Maris Curran,"David Oyelowo, Dianne Wiest, Rosie Perez, Teyonah Parris, Hani Furstenberg, Bill Raymond",United States,4.6,"April 1, 2017"
1110,Fiza,163,2000,"Dramas, International Movies, Music & Musicals",Khalid Mohamed,"Karisma Kapoor, Jaya Bhaduri, Hrithik Roshan, Neha, Asha Sachdev, Bikram Saluja, Isha Koppikar, Johny Lever, Sushmita Sen, Manoj Bajpayee",India,6.1,"August 2, 2018"
1111,Flavors of Youth: International Version,74,2018,"Anime Features, International Movies, Romantic Movies","Xiaoxing Yi, Yoshitaka Takeuchi, Haoling Li","Taito Ban, Mariya Ise, Minako Kotobuki, Haruka Shiraishi, Hiroki Yasumoto, Takeo Otsuka, Ikumi Hasegawa, Takayuki Nakatsukasa","China, Japan",6.6,"August 4, 2018"
1112,Flimflam,102,2016,"Comedies, International Movies",Khaled Marei,"Ahmed Helmy, Donia Samir Ghanim, Sabrine, Bayyumi Fuad, Jamila Adel Awad, Bea, Yasser El Tobgy, Enaam Salousa",Egypt,5.5,"June 13, 2019"
1113,Flock of Four,83,2018,"Dramas, Independent Movies, Music & Musicals",Gregory Caruso,"Braeden Lemasters, Isaac Jay, Uriah Shelton, Dylan Riley Snyder, Coco Jones, Shane Harper, Nadji Jeter, Connor Paolo, Gatlin Green, Reg E. Cathey",United States,6.1,"August 1, 2018"
1114,Flying Guillotine 2,88,1978,"Action & Adventure, International Movies","Kang Cheng, Shan Hua","Feng Ku, Chung Wang, Szu Shih, Lung Ti, Lo Lieh, Szu-Chia Chen",Hong Kong,6.3,"July 31, 2018"
1115,Follow Me,86,2017,"Documentaries, International Movies",Asri Bendacha,Asri Bendacha,"United Arab Emirates, United States, United Kingdom",5.1,"November 16, 2018"
1117,For Colored Girls,134,2010,Dramas,Tyler Perry,"Kimberly Elise, Janet Jackson, Loretta Devine, Thandie Newton, Anika Noni Rose, Kerry Washington, Tessa Thompson, Phylicia Rashad, Whoopi Goldberg, Omari Hardwick, Macy Gray, Michael Ealy, Richard Lawson, Hill Harper, Khalil Kain",United States,6.1,"May 1, 2020"
1118,For Greater Glory,145,2012,"Dramas, International Movies",Dean Wright,"Rubén Blades, Bruce Greenwood, Bruce McGill, Peter O'Toole, Andy Garcia, Nestor Carbonell, Eduardo Verástegui, Catalina Sandino Moreno, Eva Longoria, Santiago Cabrera, Adrian Alonso, Oscar Isaac, Mauricio Kuri",Mexico,6.6,"August 2, 2019"
1119,For Here or to Go?,105,2015,"Comedies, Dramas, Independent Movies",Rucha Humnabadkar,"Ali Fazal, Melanie Chandra, Rajit Kapoor, Amitosh Nagpal, Omi Vaidya, Samrat Chakrabarti, Keith Stevenson","United States, India",6.7,"August 15, 2018"
1120,For Love or Money,95,1993,"Comedies, Romantic Movies",Barry Sonnenfeld,"Michael J. Fox, Gabrielle Anwar, Anthony Higgins, Michael Tucker, Bob Balaban, Udo Kier, Dan Hedaya, Fyvush Finkel, Isaac Mizrahi, Debra Monk, Donna Mitchell",United States,6.2,"April 15, 2020"
1121,For Your Own Good,93,2017,"Comedies, International Movies",Carlos Therón,"Jose Coronado, Javier Cámara, Roberto Álamo, Pilar Castro, María Pujalte, Carmen Ruiz, Silvia Alonso, Georgina Amorós, Andrea Ros, Miki Esparbé",Spain,5.5,"October 1, 2017"
1122,For the Birds,93,2018,Documentaries,Richard Miron,Kathy Murphy,United States,6.7,"September 1, 2019"
1123,For the Broken Hearted,93,2018,"Dramas, International Movies, Romantic Movies",Digo Ricio,"Yassi Pressman, Sam Concepcion, Louise De Los Reyes, Shy Carlos, Marco Gumabao, Katya Santos, Andrea Del Rosario, Lander Vera Perez, Christopher Roxas",Philippines,6.7,"April 15, 2020"
1124,For the Love of Spock,112,2016,Documentaries,Adam Nimoy,"Leonard Nimoy, William Shatner, George Takei, Nichelle Nichols, Chris Pine, Zachary Quinto, Simon Pegg, Zoe Saldana, Jim Parsons, Jason Alexander, Neil deGrasse Tyson, J.J. Abrams","Canada, United States",7.6,"December 2, 2016"
1125,Forbidden Games: The Justin Fashanu Story,81,2017,"Documentaries, International Movies, LGBTQ Movies","Jon Carey, Adam Darke","Justin Fashanu, John Fashanu",United Kingdom,6.5,"December 1, 2017"
1126,Force 2,123,2016,"Action & Adventure, International Movies",Abhinay Deo,"John Abraham, Sonakshi Sinha, Tahir Raj Bhasin, Narendra Jha, Adil Hussain, Vikram Kapadia, Patricia Hittler, Genelia D'souza, Raj Babbar, Freddy Daruwala, Boman Irani",India,6.2,"February 27, 2017"
1127,Forensic,132,2020,"International Movies, Thrillers","Akhil Paul, Anas Khan","Tovino Thomas, Mamtha Mohandas, Renji Panicker, Saiju Kurup, Reba Monica John, Pratap Pothen, Giju John, Sreekanth Murali",India,6.6,"June 7, 2020"
1129,Forgive Us Our Debts,105,2018,"Dramas, International Movies",Antonio Morabito,"Marco Giallini, Claudio Santamaria, Jerzy Stuhr, Flonja Kodheli","Italy, Switzerland, Albania, Poland",6.0,"May 4, 2018"
1130,Forgotten,109,2017,"Dramas, International Movies, Thrillers",Hang-Jun Jang,"Ha-neul Kang, Moo-Yul Kim, Young-hee Na, Seong-kun Mun, Myung-Ryul Nam, Eun-woo Lee, Chan-bi Jung, Go Choi, Seong-il Bae, Soon-won Lee",South Korea,7.4,"February 21, 2018"
1132,Fortune Feimster: Sweet & Salty,61,2020,Stand-Up Comedy,Krysia Plonka,Fortune Feimster,United States,6.8,"January 21, 2020"
1133,Four Sisters and a Wedding,125,2013,"Comedies, Dramas, International Movies",Cathy Garcia-Molina,"Bea Alonzo, Toni Gonzaga, Angel Locsin, Shaina Magdayao, Enchong Dee, Sam Milby, Angeline Quinto, Coney Reyes",Philippines,7.3,"February 27, 2019"
1134,Fractured,100,2019,Thrillers,Brad Anderson,"Sam Worthington, Lily Rabe, Stephen Tobolowsky, Adjoa Andoh, Lucy Capri, Lauren Cochrane, Shane Dean",United States,6.4,"October 11, 2019"
1136,Frances Ha,86,2012,"Comedies, Dramas, Independent Movies",Noah Baumbach,"Greta Gerwig, Mickey Sumner, Charlotte d'Amboise, Adam Driver, Hannah Dunne, Michael Esper, Grace Gummer, Patrick Heusinger, Josh Hamilton, Cindy Katz, Maya Kazan, Justine Lupe, Britta Phillips, Juliet Rylance, Dean Wareham, Michael Zegen",United States,7.5,"October 1, 2017"
1138,Franco Escamilla: Bienvenido al mundo,54,2019,Stand-Up Comedy,Ulises Valencia,Franco Escamilla,Mexico,7.2,"April 17, 2019"
1139,Franco Escamilla: Por la anécdota,66,2018,Stand-Up Comedy,Ulises Valencia,Franco Escamilla,Mexico,6.8,"June 8, 2018"
1140,Frank & Lola,87,2016,"Dramas, Thrillers",Matthew Ross,"Michael Shannon, Imogen Poots, Michael Nyqvist, Justin Long, Stella Schnabel, Rosanna Arquette, Emmanuelle Devos",United States,5.9,"March 1, 2020"
1141,Frank and Cindy,102,2015,"Comedies, Dramas, Independent Movies",G.J. Echternkamp,"Rene Russo, Oliver Platt, Johnny Simmons, Jane Levy, Marc Maron, Ron Myles, Jessica Garrison, Fabianne Therese",United States,6.1,"April 1, 2016"
1142,"Frankenstein’s Monster’s Monster, Frankenstein",32,2019,Comedies,Daniel Gray Longino,"David Harbour, Alex Ozerov, Kate Berlant, Mary Woronov, Alfred Molina, Heather Lawless, Michael Lerner, Marion Van Cuyck, Bridey Elliott, O-Lan Jones, Lidia Porto, Graham Wagner, Randolph Thompson",United States,5.9,"July 16, 2019"
1143,Frat Star,85,2017,Comedies,"Grant S. Johnson, Ippsie Jones","Connor Lawrence, Justin Mark, Cathryn Dylan, Chris Elliott, Tyler Weaks, Max Sheldon, Austin Ramsey, Peter O'Connor, Nicole Balsam, Kaitlin Mesh",United States,3.7,"April 10, 2017"
1144,Freaks,105,2018,"Independent Movies, Sci-Fi & Fantasy, Thrillers","Adam B. Stein, Zach Lipovsky","Emile Hirsch, Bruce Dern, Lexy Kolker, Grace Park, Amanda Crew, Aleks Paunovic, Michelle Harrison","Canada, United States",6.7,"March 3, 2020"
1146,Free Fire,91,2016,"Action & Adventure, Comedies, Independent Movies",Ben Wheatley,"Sharlto Copley, Armie Hammer, Brie Larson, Cillian Murphy, Jack Reynor, Babou Ceesay, Enzo Cilenti, Sam Riley, Michael Smiley, Noah Taylor, Patrick Bergin, Mark Monero",United Kingdom,6.4,"October 21, 2019"
1149,Freedom Writers,124,2007,Dramas,Richard LaGravenese,"Hilary Swank, Patrick Dempsey, Scott Glenn, Imelda Staunton, April L. Hernandez, Mario, Kristin Herrera, Jaclyn Ngan, Sergio Montalvo, Jason Finn, Deance Wyatt, Vanetta Smith","Germany, United States",7.5,"March 1, 2020"
1151,Freezer's Campaign,116,2016,"Comedies, International Movies",Sameh Abdulaziz,"Bayyumi Fuad, Chico, Hesham Maged, Ahmed Fathy, Nesreen Ameen, Dareen Haddad, Bushra, Samy Maghawry",Egypt,5.1,"June 6, 2019"
1152,French Dirty,72,2015,"Dramas, Independent Movies","Wade Allain-Marcus, Jesse Allain-Marcus","Wade Allain-Marcus, Arjun Gupta, Melina Lizette, Elsa Biedermann, Katie Blake, Santana Dempsey",United States,5.3,"February 4, 2016"
1153,French Toast,86,2015,"Comedies, International Movies, Romantic Movies","Paul Krüger, Anél Stolp","Lika Berning, Thierry Ballarin, Deon Lotz, Heléne Lombard, Paul du Toit, Roberta Fox, Trudi Conradie, Rod Alexander, Lochner De Kock, Tony Caprari",South Africa,5.6,"February 12, 2020"
1154,Freshman Year,104,2019,"Dramas, Faith & Spirituality",Jude Okwudiafor Johnson,"Diallo Thompson, Natalia Dominguez, Benjamin A. Onyango, Gregory Alan Williams, Desalene Jones, Wynton Odd, Ed Gonzalez Moreno, Natasha Dee Davis, Cameron Schaefer, Joshua Flores-Q",United States,4.8,"March 3, 2020"
1155,Frida,123,2002,"Dramas, Romantic Movies",Julie Taymor,"Salma Hayek, Mía Maestro, Alfred Molina, Antonio Banderas, Valeria Golino, Diego Luna, Edward Norton, Saffron Burrows, Roger Rees, Geoffrey Rush, Ashley Judd","Mexico, United States, Canada",7.4,"July 1, 2020"
1156,Friend Request,92,2016,"Horror Movies, International Movies",Simon Verhoeven,"Alycia Debnam-Carey, William Moseley, Connor Paolo, Brit Morgan, Brooke Markham, Sean Marquette, Liesl Ahlers, Shashawnee Hall, Susan Danford",Germany,5.3,"April 18, 2018"
1157,Friendship,161,1980,"Action & Adventure, Dramas, International Movies",Raj Khosla,"Amitabh Bachchan, Shatrughan Sinha, Zeenat Aman, Prem Chopra, Amrish Puri, Helen, Pran, Gajanan Jagirdar, Sajjan, Iftekhar",India,6.7,"April 1, 2020"
1158,From A to B,104,2014,"Comedies, Dramas, International Movies",Ali F. Mostafa,"Fahad Albutairi, Shadi Alfons, Fadi Rifaai, Samer al Masri, Wonho Chung, Leem Lubany, Maha Abou Ouf, Ahd, Yousra El Lozy, Ali Suliman, Khaled Abol Naga, Madeline Zima","United Arab Emirates, Jordan, Lebanon",5.8,"June 11, 2020"
1159,From Japan to Egypt,93,2017,"Children & Family Movies, Comedies, Dramas",Mahmoud Karim,"Ahmed Eid, Saki Tsukamoto, Nada Moussa, Mohammed Tharwat",Egypt,5.3,"June 6, 2019"
1161,Froning: The Fittest Man in History,99,2016,"Documentaries, International Movies, Sports Movies",Heber Cannon,Rich Froning,United States,6.7,"July 15, 2018"
1162,Fronteras,106,2018,"Dramas, Independent Movies, Thrillers",Andrew Dean,"Steve Oropeza, Steven Sean Garland, Wade Everett, Randy Green, Cortez Chappell, Tori Osborn, Larry Coulter, Cris Acosta",United States,4.3,"February 9, 2020"
1163,Frost/Nixon,122,2008,Dramas,Ron Howard,"Frank Langella, Michael Sheen, Sam Rockwell, Kevin Bacon, Matthew Macfadyen, Oliver Platt, Rebecca Hall, Toby Jones, Andy Milder, Kate Jennings Grant","United Kingdom, France, United States",7.7,"June 17, 2020"
1164,Fukrey,135,2013,"Action & Adventure, Comedies, Dramas",Mrighdeep Singh Lamba,"Pulkit Samrat, Manjot Singh, Ali Fazal, Varun Sharma, Richa Chadda, Priya Anand, Vishakha Singh, Pankaj Tripathi",India,6.9,"December 15, 2019"
