id,movie_name,Duration,year,genre,director,actors,country,rating,enter_in_netflix
2860,Sinister 2,97,2015,Horror Movies,Ciarán Foy,"Shannyn Sossamon, John Beasley, James Ransone, Tate Ellington, Robert Daniel Sloan, Dartanian Sloan, Lucas Jade Zumann, Lea Coco","United States, United Kingdom",5.3,"October 16, 2019"
2861,Sinister Circle,87,2017,"Horror Movies, International Movies",Dorian Fernández-Moris,"Milene Vázquez, Matías Raygada, Claudia Dammert, Marcello Rivera, Atilia Boschetti, Hernán Romero, Ismael Contreras, Pietro Sibille, Leslie Shaw",Peru,4.6,"October 1, 2019"
2862,Siren,83,2016,Horror Movies,Gregg Bishop,"Chase Williamson, Hannah Fierman, Justin Welborn, Hayes Mercure, Michael Aaron Milligan, Brittany S. Hall, Randy McDowell, Lindsey Garrett, William Mark McCullough, Patrick Wood",United States,5.3,"January 1, 2020"
2863,Sister Cities,88,2016,Dramas,Sean Hanish,"Jacki Weaver, Troian Bellisario, Stana Katic, Michelle Trachtenberg, Jess Weixler, Alfred Molina, Amy Smart, Tom Everett Scott, Kaia Gerber, Aimee Garcia, Kathy Baker, Peter Jason",United States,6.8,"December 16, 2016"
2864,Sister Code,95,2015,"Comedies, Dramas, Romantic Movies",Corey Grant,"Drew Sidora, Eva Marcille, Amber Rose, Marcus T. Paulk, Erica Ash, Essence Atkins, Amin Joseph, Rolonda Watts, Brooklyn McLinn, Don Hale Jr., Duane Martin, Anne-Marie Johnson",United States,4.6,"February 14, 2016"
2865,Sisterakas,105,2012,"Comedies, International Movies",Wenn V. Deramas,"Ai-Ai de las Alas, Vice Ganda, Kris Aquino, Xyriel Manabat, Daniel Padilla, Kathryn Bernardo, Tirso Cruz III, Deejay Durano, Gloria Diaz, Jeffrey Quizon",Philippines,5.4,"March 7, 2019"
2868,Skins,78,2017,"Dramas, International Movies",Eduardo Casanova,"Ana Polvorosa, Candela Peña, Macarena Gómez, Carmen Machi, Jon Kortajarena, Secun de la Rosa, Itziar Castro, Antonio Durán 'Morris', Joaquín Climent, Ana María Ayala, Eloi Costa",Spain,6.3,"April 1, 2017"
2869,Skiptrace,107,2016,"Action & Adventure, Comedies",Renny Harlin,"Jackie Chan, Johnny Knoxville, Fan Bingbing, Eric Tsang, Eve Torres, Winston Chao","China, Hong Kong, United States",5.7,"July 4, 2019"
2870,Sky Ladder: The Art of Cai Guo-Qiang,80,2016,Documentaries,Kevin MacDonald,Cai Guo-Qiang,United States,7.3,"October 14, 2016"
2871,Slam,99,2017,"Comedies, Dramas, International Movies",Andrea Molaioli,"Ludovico Tersigni, Jasmine Trinca, Luca Marinelli, Barbara Ramella, Gianluca Broccatelli, Pietro Ragusa, Fiorenza Tessari",Italy,6.1,"April 15, 2017"
2872,Sleeping with Other People,101,2015,"Comedies, Dramas, Independent Movies",Leslye Headland,"Jason Sudeikis, Alison Brie, Adam Scott, Jason Mantzoukas, Natasha Lyonne, Adam Brody, Amanda Peet",United States,6.5,"October 2, 2017"
2873,Sleepless,95,2017,Action & Adventure,Baran bo Odar,"Jamie Foxx, Michelle Monaghan, Scoot McNairy, Dermot Mulroney, T.I., David Harbour, Gabrielle Union, Octavius J. Johnson, Tim Connolly, Drew Sheer",United States,5.6,"May 8, 2020"
2874,Sleepless in Seattle,105,1993,"Classic Movies, Comedies, Dramas",Nora Ephron,"Tom Hanks, Meg Ryan, Rob Reiner, Bill Pullman, Rita Wilson, Ross Malinger, Rosie O'Donnell, Frances Conroy",United States,6.8,"July 1, 2020"
2875,Sleepover,89,2004,"Comedies, Romantic Movies",Joe Nussbaum,"Alexa PenaVega, Mika Boorem, Jane Lynch, Sam Huntington, Sara Paxton, Brie Larson, Scout Taylor-Compton, Douglas Smith, Katija Pevec, Steve Carell, Jeff Garlin",United States,5.4,"March 1, 2020"
2876,Sleepy Hollow,106,1999,"Horror Movies, Sci-Fi & Fantasy",Tim Burton,"Johnny Depp, Christina Ricci, Miranda Richardson, Michael Gambon, Casper Van Dien, Jeffrey Jones, Christopher Lee, Christopher Walken, Richard Griffiths, Martin Landau","Germany, United States",7.3,"July 1, 2020"
2877,Slow Country,115,2017,"Dramas, International Movies",Eric Aghimien,"Ivie Okujaye, Sambasa Nzeribe, Tope Tedela, Gina Castel, Majid Michel, Victor Erabie, Brutus Richard, Adebayo Thomas",Nigeria,4.0,"December 6, 2019"
2878,Slow West,84,2015,"Action & Adventure, Dramas, International Movies",John Maclean,"Kodi Smit-McPhee, Michael Fassbender, Ben Mendelsohn, Caren Pistorius, Rory McCann, Andrew Robertt, Edwin Wright, Kalani Queypo","United Kingdom, New Zealand",6.9,"July 26, 2018"
2879,Small Crimes,95,2017,"Dramas, Thrillers",Evan Katz,"Nikolaj Coster-Waldau, Gary Cole, Molly Parker, Macon Blair, Pat Healy, Jacki Weaver, Robert Forster","Canada, United States",5.8,"April 28, 2017"
2880,Smoke & Mirrors,123,2016,"Dramas, International Movies, Thrillers",Alberto Rodríguez,"Eduard Fernández, José Coronado, Marta Etura, Carlos Santos, Enric Benavent, Philippe Rebbot, Israel Elejalde, Tomás del Estal, Emilio Gutiérrez Caba",Spain,6.9,"June 1, 2017"
2881,Sniper: Special Ops,86,2016,"Action & Adventure, Dramas",Fred Olen Ray,"Steven Seagal, Rob Van Dam, Tim Abell, Charlene Amoia, Daniel Booko, Jason-Shane Scott, Anthony Batarse, Gerald Webb",United States,3.2,"January 10, 2020"
2882,Snowpiercer,126,2013,"Action & Adventure, Cult Movies, International Movies",Bong Joon Ho,"Chris Evans, Song Kang-ho, Ed Harris, John Hurt, Tilda Swinton, Jamie Bell, Octavia Spencer, Ewen Bremner, Alison Pill, Adnan Haskovic, Vlad Ivanov, Ko A-sung, Luke Pasqualino","South Korea, Czech Republic",7.1,"May 1, 2019"
2883,Socha Na Tha,137,2005,"Comedies, International Movies, Romantic Movies",Imtiaz Ali,"Abhay Deol, Ayesha Takia, Apoorva Jha, Ayesha Jhulka, Rati Agnihotri, Sandhya Mridul, Suresh Oberoi, Manish Chaudhary",India,7.4,"July 1, 2018"
2885,Soekarno,142,2013,"Dramas, International Movies",Hanung Bramantyo,"Ario Bayu, Lukman Sardi, Maudy Koesnaedi, Tanta Ginting, Tika Bravani, Emir Mahira, Sujiwo Tedjo, Ayu Laksmi, Matias Muchus",Indonesia,7.0,"January 5, 2019"
2886,Sofía Niño de Rivera: Exposed,80,2016,Stand-Up Comedy,"Raúl Campos, Jan Suter",Sofía Niño de Rivera,Mexico,7.4,"June 24, 2016"
2887,Sofía Niño de Rivera: Selección Natural,62,2018,Stand-Up Comedy,"Raúl Campos, Jan Suter",Sofía Niño de Rivera,Mexico,6.8,"March 30, 2018"
2888,Sohni Mahiwal,160,1984,"Dramas, International Movies, Romantic Movies","Latif Faiziyev, Umesh Mehra","Zeenat Aman, Pran, Tanuja, Poonam Dhillon","India, Soviet Union",6.1,"September 1, 2017"
2890,Solo,150,2017,"Dramas, International Movies",Bejoy Nambiar,"Dulquer Salmaan, Nassar, Sruthi Hariharan, Dhansika, Anson Paul, Neha Sharma",India,7.1,"March 1, 2018"
2891,Solo Con Tu Pareja,94,1991,"Comedies, Independent Movies, International Movies",Alfonso Cuarón,"Luis de Icaza, Dobrina Liubomirova, Isabel Benet, Claudia Fernandez, Luz María Jerez, Claudia Ramírez, Astrid Hadad, Toshiro Hisaki, Daniel Giménez Cacho, Carlos Nakasone, Ricardo Dalmacci, Nevil Wilton, John Keyser, Raúl Valerio, Monserrat Ontiveros, Daniel Gimenez Cacho",Mexico,6.9,"September 1, 2018"
2892,Some Kind of Beautiful,100,2014,"Comedies, Romantic Movies",Tom Vaughan,"Pierce Brosnan, Salma Hayek, Jessica Alba, Malcolm McDowell, Duncan Joiner, Ben McKenzie, Merrin Dungey, Fred Melamed, Ivan Sergei, Lombardo Boyar, Marlee Matlin","United States, United Kingdom",5.7,"March 20, 2020"
2893,Someone Great,92,2019,"Comedies, Romantic Movies",Jennifer Kaytin Robinson,"Gina Rodriguez, Brittany Snow, DeWanda Wise, Lakeith Stanfield, RuPaul Charles, Peter Vack, Alex Moffat, Rosario Dawson, Rebecca Naomi Jones, Jaboukie Young-White, Michelle Buteau, Questlove",United States,6.2,"April 19, 2019"
2894,Something Huge,87,2017,"Comedies, Independent Movies, International Movies",Carlo Padial,"Berto Romero, Carolina Bang, Javier Botet, Carlos Areces, Miguel Noguera, Toni Sevilla",Spain,4.6,"March 1, 2018"
2895,Sometimes,101,2016,"Dramas, International Movies",Priyadarshan,"Prakash Raj, Shreya Reddy, Ashok Selvan",India,7.2,"May 1, 2018"
2896,Sommore: Chandelier Status,77,2013,Stand-Up Comedy,Kevin Layne,Sommore,United States,6.4,"July 4, 2018"
2897,Sommore: The Reign Continues,93,2015,Stand-Up Comedy,Kevin Layne,Sommore,United States,6.7,"November 1, 2018"
2898,Son of a Gun,109,2014,"Action & Adventure, Dramas, Independent Movies",Julius Avery,"Ewan McGregor, Brenton Thwaites, Alicia Vikander, Jacek Koman, Matt Nable, Tom Budge, Eddie Baroo, Nash Edgerton","Australia, United Kingdom, Canada",6.5,"July 19, 2018"
2899,Song of the Sea,94,2014,Children & Family Movies,Tomm Moore,"David Rawle, Brendan Gleeson, Fionnula Flanagan, Lisa Hannigan, Lucy O'Connell, Jon Kenny, Pat Shortt, Colm Ó'Snodaigh, Liam Hourican, Kevin Swierszcz","Ireland, Denmark, Belgium, Luxembourg, France",8.1,"May 1, 2020"
2900,Soni,97,2018,"Dramas, Independent Movies, International Movies",Ivan Ayr,"Geetika Vidya Ohlyan, Saloni Batra, Mohinder Gujral, Mohit Chauhan, Vikas Shukla, Gauri Chakraborty, Simrat Kaur, Dimple Kaur",India,7.2,"January 18, 2019"
2901,Soorma,131,2018,"Dramas, International Movies, Sports Movies",Shaad Ali,"Diljit Dosanjh, Tapsee Pannu, Angad Bedi, Kulbhushan Kharbanda, Satish Kaushik, Vijay Raaz, Seema Kaushal, Mahabir Bhullar, Alka Badola Kaushal, Jimmy Moses",India,7.4,"October 13, 2018"
2902,Sorry To Disturb,116,2008,"Dramas, International Movies",Khaled Marei,"Ahmed Helmy, Mahmoud Hemeida, Menna Shalaby, Dalal Abdelaziz, Mohamed Sharaf, Tarek El Tilmisany, Mohammed El Sadaany, Samy Maghawry, Ahmed Fouad Selim, Ahmed Ramah",Egypt,8.0,"June 2, 2020"
2903,Soul Plane,86,2004,"Comedies, Cult Movies",Jessy Terrero,"Kevin Hart, Method Man, Snoop Dogg, Tom Arnold, K.D. Aubert, Godfrey, Brian Hooks, D.L. Hughley, Arielle Kebbel, Loni Love, Mo'Nique, Ryan Pinkston, Missi Pyle, Sommore, Sofía Vergara, Gary Anthony Williams, John Witherspoon",United States,4.5,"April 1, 2020"
2904,Soul Robbers,88,2015,"Horror Movies, International Movies",Juan Antonio de la Riva,"Sofía Sisniega, Natasha Dupeyron, Ana Sofía Durán, Javier Escobar, Luis Gatica, Juan Ángel Esparza, Jorge Luis Moreno, Arnulfo Reyes Sanchez, Tizoc Arroyo, José Enot, Ricardo Dalmacci, Harding Junior, Claudine Sosa, Pablo Valentín",Mexico,4.9,"July 1, 2018"
2905,Soul Surfer,106,2011,"Dramas, Faith & Spirituality, Sports Movies",Sean McNamara,"AnnaSophia Robb, Helen Hunt, Dennis Quaid, Carrie Underwood, Kevin Sorbo, Ross Thomas, Chris Brochu, Lorraine Nicholson, Jeremy Sumpter, Sonya Balmores, Craig T. Nelson, Mark Kubr, Kim Morgan Greene, Titus Kinimaka, Branscombe Richmond, Sonya Balmores Chung, Kimberly-Rose Wolter, John Philbin, David Chokachi, Wesley Mann",United States,7.0,"May 17, 2020"
2907,Spaceballs,96,1987,"Comedies, Cult Movies, Sci-Fi & Fantasy",Mel Brooks,"Mel Brooks, John Candy, Rick Moranis, Bill Pullman, Daphne Zuniga, Dick Van Patten, George Wyner, Michael Winslow, Joan Rivers, John Hurt",United States,7.1,"July 1, 2020"
2908,Spanish Affair 2,107,2015,"Comedies, International Movies, Romantic Movies",Emilio Martínez Lázaro,"Dani Rovira, Clara Lago, Karra Elejalde, Carmen Machi, Belén Cuesta, Berto Romero, Rosa María Sardà, Alfonso Sánchez, Alberto López, Josep Maria Riera",Spain,5.4,"November 1, 2016"
2909,Sparring,94,2017,"Dramas, International Movies, Sports Movies",Samuel Jouy,"Mathieu Kassovitz, Olivia Merilahti, Souleymane M'Baye, Billie Blain, Malik Bine, Zakariya Gouram, Jolente De Keersmaeker, Lyes Salem, Ali Labidi, David Saracino",France,6.3,"September 1, 2018"
2910,Special 26,137,2013,"Dramas, International Movies, Thrillers",Neeraj Pandey,"Akshay Kumar, Manoj Bajpayee, Anupam Kher, Jimmy Shergill, Kajal Aggarwal, Divya Dutta, Kharaj Mukherjee, Rajesh Sharma, Kishore Kadam, Neeru Bajwa, Deep Raj Rana, Neetu Singh",India,8.0,"July 5, 2020"
2911,Special Correspondents,101,2016,Comedies,Ricky Gervais,"Eric Bana, Ricky Gervais, Vera Farmiga, Kelly Macdonald, Kevin Pollak, America Ferrera, Raúl Castillo, Benjamin Bratt","Canada, United Kingdom, United States",5.8,"April 29, 2016"
2912,Spectral,108,2016,"Action & Adventure, Sci-Fi & Fantasy",Nic Mathieu,"James Badge Dale, Emily Mortimer, Bruce Greenwood, Max Martini, Clayne Crawford, Cory Hardrict, Louis Ozawa Changchien, Jimmy Akingbola, Dylan Smith, Philip Bulcock","United States, Hungary",6.3,"December 9, 2016"
2913,Speech & Debate,96,2017,"Comedies, Dramas, Independent Movies",Dan Harris,"Liam James, Sarah Steele, Austin McKenzie, Roger Bart, Janeane Garofalo, Wendi McLendon-Covey, Kal Penn, Kimberly Williams-Paisley, Skylar Astin, Edgar Arreola, Sarah Baker",United States,5.9,"July 6, 2017"
2916,Spenser Confidential,111,2020,"Action & Adventure, Comedies",Peter Berg,"Mark Wahlberg, Winston Duke, Alan Arkin, Bokeem Woodbine, Iliza Shlesinger, Hope Olaide Wilson, Marc Maron",United States,6.2,"March 6, 2020"
2917,Spider-Man: Into the Spider-Verse,117,2018,"Action & Adventure, Comedies","Peter Ramsey, Rodney Rothman, Bob Persichetti","Shameik Moore, Jake Johnson, Hailee Steinfeld, Brian Tyree Henry, Lauren Vélez, Mahershala Ali, Lily Tomlin, Kathryn Hahn, Liev Schreiber, Kimiko Glenn, Nicolas Cage, John Mulaney",United States,8.4,"June 26, 2019"
2919,Spitfire: The Plane that Saved the World,95,2018,Documentaries,"David Fairhead, Anthony Palmer",Charles Dance,United Kingdom,7.5,"November 1, 2019"
2920,Spivak,92,2017,"Comedies, Independent Movies","Anthony Abrams, Adam Larson Broder","Michael Bacall, Maggie Lawson, Elden Henson, Robert Kazinsky, Mark Webber, Chloe Wepper",United States,5.6,"May 12, 2018"
2921,Splatter,29,2009,Horror Movies,Joe Dante,"Corey Feldman, Tony Todd, Tara Leigh, Erin Way, Mark Alan, Stuart Pankin",United States,3.1,"November 18, 2009"
2922,Splice,104,2009,"Horror Movies, Sci-Fi & Fantasy, Thrillers",Vincenzo Natali,"Adrien Brody, Sarah Polley, Delphine Chanéac, Brandon McGibbon, Simona Maicanescu, David Hewlett, Abigail Chu",Canada,5.7,"July 1, 2020"
2923,Spookley the Square Pumpkin,47,2004,Children & Family Movies,Bernie Denk,"Sonja Ball, Craig Francis, Rick Jones, Michel Perron, Holly Gauthier-Frankel, Norman Groulx, Terrence Scammell, Bruce Dinsmore, Jennifer Seguin",United States,5.0,"September 1, 2019"
2924,Springsteen on Broadway,153,2018,Music & Musicals,Thom Zimny,Bruce Springsteen,United States,8.5,"December 16, 2018"
2925,Sprinter,112,2018,"Dramas, International Movies, Sports Movies",Storm Saulter,"Dale Elliott, Kadeem Wilson, Dennis Titus, David Alan Grier, Shantol Jackson, Lorraine Toussaint, Bryshere Gray, Quera South, Aiden Moodie","Jamaica, United States",6.0,"April 15, 2020"
2926,Spy Kids: All the Time in the World,88,2011,"Children & Family Movies, Comedies",Robert Rodriguez,"Jessica Alba, Joel McHale, Rowan Blanchard, Mason Cook, Jeremy Piven, Alexa PenaVega, Daryl Sabara, Ricky Gervais, Danny Trejo",United States,3.5,"February 19, 2019"
2927,Spy Time,93,2015,"Action & Adventure, Comedies, International Movies",Javier Ruiz Caldera,"Imanol Arias, Quim Gutiérrez, Alexandra Jiménez, Berto Romero, Carlos Areces, Eduardo Gómez, Dani El Rojo, Emilio Gutiérrez Caba, Rossy de Palma, Sílvia Abril",Spain,6.1,"June 1, 2016"
2928,Spyder,140,2017,"Action & Adventure, International Movies",A.R. Murugadoss,"Mahesh Babu, Rakul Preet Singh, S.J. Surya, Bharath Srinivasan, Priyadarshi Pullikonda, RJ Balaji",India,6.6,"August 28, 2018"
2929,St. Agatha,103,2018,"Horror Movies, Independent Movies",Darren Lynn Bousman,"Sabrina Kern, Carolyn Hennesy, Courtney Halverson, Shaun Fletcher, Lindsay Seim, Hannah Fierman, Trin Miller, Seth Michaels, Justin Miles",United States,5.2,"August 8, 2019"
2930,Stand and Deliver,103,1988,"Dramas, Independent Movies",Ramon Menendez,"Edward James Olmos, Lou Diamond Phillips, Rosanna DeSoto, Andy Garcia, Will Gotay, Ingrid Oliu, Vanessa Marquez, Karla Montana",United States,7.3,"July 1, 2020"
2931,Stardust,128,2007,"Action & Adventure, International Movies, Romantic Movies",Matthew Vaughn,"Claire Danes, Michelle Pfeiffer, Robert De Niro, Charlie Cox, Sienna Miller, Ricky Gervais, Jason Flemyng, Rupert Everett, Peter O'Toole, Mark Strong, Kate Magowan, Ian McKellen","United Kingdom, United States",7.6,"July 1, 2020"
2932,Starred Up,106,2013,"Dramas, Independent Movies, International Movies",David Mackenzie,"Jack O'Connell, Ben Mendelsohn, Rupert Friend, Sam Spruell, Anthony Welsh, David Ajala, Peter Ferdinando, Gershwyn Eustache Jnr, Ashley Chin, Raphael Sowole, Gilly Gilchrist, Tommy McDonnell",United Kingdom,7.4,"August 29, 2019"
2933,Starship Troopers,129,1997,"Action & Adventure, Cult Movies, Sci-Fi & Fantasy",Paul Verhoeven,"Casper Van Dien, Dina Meyer, Denise Richards, Jake Busey, Neil Patrick Harris, Clancy Brown, Seth Gilliam, Patrick Muldoon, Michael Ironside, Rue McClanahan",United States,7.2,"June 1, 2020"
2934,Starsky & Hutch,101,2004,"Action & Adventure, Comedies",Todd Phillips,"Ben Stiller, Owen Wilson, Vince Vaughn, Juliette Lewis, Snoop Dogg, Fred Williamson, Jason Bateman, Amy Smart, Carmen Electra, George Cheung",United States,6.1,"July 1, 2020"
2935,Starting Over Again,128,2014,"Dramas, International Movies, Romantic Movies",Olivia M. Lamasan,"Piolo Pascual, Toni Gonzaga, Iza Calzado",Philippines,7.1,"March 7, 2019"
2936,Steal a Pencil for Me,94,2006,Documentaries,Michèle Ohayon,"Jack Polak, Ina Soep",United States,7.5,"September 15, 2019"
2938,Steel Rain,140,2018,"Action & Adventure, Dramas, International Movies",Yang Woo-seok,"Woo-sung Jung, Do-won Kwak, Kap-soo Kim, Woo-jin Jo, Eui-sung Kim, Kyeong-yeong Lee, Won-joong Jung, Hyun-sung Jang",South Korea,7.1,"March 14, 2018"
2939,Step Outside,89,2018,"Comedies, International Movies",Wael Ihsan,"Kareem Mahmoud Abdel Aziz, Khaled El Sawy, Ahmed Fathy, Malak Koura, Ashraf Abdel Baqi",Egypt,4.7,"June 6, 2019"
2940,Step Sisters,108,2018,Comedies,Charles Stone III,"Megalyn Echikunwoke, Eden Sher, Lyndon Smith, Gage Golightly, Matt McGorry, Marque Richardson, Alessandra Torresani, Naturi Naughton, Nia Jervier, Robert Curtis Brown",United States,5.4,"January 19, 2018"
2941,Stephanie,86,2017,Horror Movies,Akiva Goldsman,"Shree Cooks, Frank Grillo, Anna Torv",United States,5.8,"September 1, 2018"
2942,Stereo,91,2014,"International Movies, Thrillers",Maximilian Erlenwein,"Jürgen Vogel, Moritz Bleibtreu, Petra Schmidt-Schaller, Georg Friedrich, Rainer Bock, Mark Zak, Helena Schönfelder, Fabian Hinrichs",Germany,6.5,"January 15, 2017"
2943,Steve Jobs,122,2015,Dramas,Danny Boyle,"Michael Fassbender, Kate Winslet, Seth Rogen, Jeff Daniels, Michael Stuhlbarg, Katherine Waterston, Perla Haney-Jardine, Sarah Snook, John Ortiz, Adam Shapiro","United Kingdom, United States",7.2,"January 16, 2020"
2944,Steve Martin and Martin Short: An Evening You Will Forget for the Rest of Your Life,74,2018,Stand-Up Comedy,Marcus Raboy,"Steve Martin, Martin Short",United States,7.1,"May 25, 2018"
2945,Still,100,2010,"Horror Movies, International Movies","Chatchai Katenut, Manussa Vorasingha, Tanwarin Sukkhapisit, Poj Arnon","Mai Charoenpura, Akara Amarttayakul, Supakson Chaimongkol, Kachapa Toncharoen, Wiradit Srimalai, Vasana Chalakorn, Ratchanont Sukpragawp, Arisara Thongborisut",Thailand,4.4,"September 14, 2018"
2947,Stink!,91,2015,Documentaries,Jon J. Whelan,Jeffrey Hollender,United States,7.1,"November 1, 2018"
2948,Stonehearst Asylum,113,2014,"Horror Movies, Thrillers",Brad Anderson,"Kate Beckinsale, Jim Sturgess, David Thewlis, Brendan Gleeson, Ben Kingsley, Michael Caine, Jason Flemyng, Sophie Kennedy Clark, Sinéad Cusack, Edmund Kingsley",United States,6.8,"September 8, 2017"
2949,Story of an Egg,132,2017,"Comedies, International Movies, Romantic Movies",Raj B. Shetty,"Raj B. Shetty, Usha Bhandary, Shailashree, Prakash Tuminadu, Amrutha Naik, Shreya Anchan, VJ Vineeth, Rahul Amin, Deepak Rai Panaje, Ramdas",India,8.0,"October 15, 2017"
2950,Straight Up,96,2020,"Comedies, Independent Movies, LGBTQ Movies",James Sweeney,"James Sweeney, Katie Findlay, Randall Park, Hillary Anne Matthews, James Scully, Betsy Brandt",United States,6.6,"June 26, 2020"
2951,Strange Voices,96,1987,Dramas,Arthur Allan Seidelman,"Nancy McKeon, Valerie Harper, Stephen Macht, Tricia Leigh Fisher, Millie Perkins",United States,6.5,"October 1, 2011"
2952,Strange Weather,91,2016,"Dramas, Independent Movies",Katherine Dieckmann,"Holly Hunter, Carrie Coon, Kim Coates, Shane Jacobsen, Andrene Ward-Hammond, Allene Quincy, Glenne Headly",United States,5.9,"October 26, 2017"
2954,Stree,127,2018,"Comedies, Horror Movies, Independent Movies",Amar Kaushik,"Rajkummar Rao, Shraddha Kapoor, Pankaj Tripathi, Aparshakti Khurana, Abhishek Banerjee, Atul Srivastava",India,7.6,"June 7, 2019"
2955,Street Flow,96,2019,"Dramas, International Movies","Leïla Sy, Kery James","Kery James, Jammeh Diangana, Chloé Jouannet, Bakary Diombera",France,6.4,"October 13, 2019"
2956,Stretch Armstrong: The Breakout,4,2018,Children & Family Movies,Victor Cook,"Scott Menville, Steven Yeun, Ogie Banks, Nazneen Contractor, Kate Mulgrew, Wil Wheaton, Keith David, Jon Heder, Yvette Nicole Brown, Clancy Brown, James Arnold Taylor, Grey Griffin, Miguel Ferrer, Kelly Hu, Walter Koenig, Vanessa Marshall, Will Friedle, Andrew Kishino",United States,6.5,"March 13, 2018"
2959,Stuart Little,85,1999,"Children & Family Movies, Comedies",Rob Minkoff,"Michael J. Fox, Jonathan Lipnicki, Geena Davis, Hugh Laurie, Nathan Lane","Germany, United States",5.9,"January 1, 2020"
2961,Stunt School,95,2019,"Children & Family Movies, Comedies, International Movies",Ali Yorgancıoğlu,"Aslı İnandık, Toygan Avanoğlu, Tuna Orhan, Caner Özyurtlu, Melis İşiten, Aslı Turanlı, Ahmet Olgun Sünear, Seda Türkmen, Ayten Uncuoğlu",Turkey,4.4,"April 16, 2020"
2963,Submission,95,2019,"Action & Adventure, Dramas",J.M. Berrios,"Scott Pryor, Darrin Dewitt Henson, Eric Roberts, Kevin Sizemore, Lorynn York, John Gray, Sara McMann, Ovince Saint Preux",United States,5.0,"November 11, 2019"
2964,Suburra,135,2015,"Dramas, International Movies, Thrillers",Stefano Sollima,"Pierfrancesco Favino, Elio Germano, Claudio Amendola, Alessandro Borghi, Greta Scarano, Giulia Gorietti, Jean-Hugues Anglade, Antonello Fassari, Lidia Vitale","Italy, France",7.4,"October 14, 2015"
2965,Sucker Punch,110,2011,"Action & Adventure, Sci-Fi & Fantasy",Zack Snyder,"Emily Browning, Abbie Cornish, Jena Malone, Vanessa Hudgens, Jamie Chung, Carla Gugino, Oscar Isaac, Jon Hamm, Scott Glenn, Richard Cetrone","United States, Canada",6.0,"July 1, 2020"
2966,Suckseed,130,2011,"Comedies, International Movies",Chayanop Boonprakob,"Jirayu La-ongmanee, Pachara Chirathivat, Nattasha Nauljam, Thawat Pornrattanaprasert",Thailand,7.5,"September 5, 2018"
2967,Sudani from Nigeria,115,2018,"Comedies, Dramas, International Movies",Zakariya,"Soubin Shahir, Samuel Abiola Robinson, Savithri Sredharan, Aneesh Menon",India,8.2,"August 1, 2018"
2968,Suffragette,107,2015,"Dramas, International Movies",Sarah Gavron,"Carey Mulligan, Helena Bonham Carter, Brendan Gleeson, Anne-Marie Duff, Ben Whishaw, Romola Garai, Meryl Streep, Finbar Lynch, Natalie Press, Samuel West, Geoff Bell, Amanda Lawrence, Shelley Longworth","United Kingdom, France",6.9,"November 16, 2019"
2970,Suicide,114,2014,"International Movies, Thrillers",Benny Fredman,"Mali Levi, Rotem Keinan, Dror Keren, Igal Naor",Israel,5.9,"July 1, 2016"
2971,Summer Night,93,2019,"Comedies, Dramas, Romantic Movies",Joseph Cross,"Ellar Coltrane, Callan McAuliffe, Ian Nelson, Lana Condor, Analeigh Tipton, Melina Vidler, Bill Milner, Justin Chatwin, Ella Hunt, Elena Kampouris, Victoria Justice, Khris Davis, Hayden Szeto",United States,4.7,"March 19, 2020"
2972,Summer of '92,94,2015,"Dramas, International Movies, Sports Movies",Kasper Barfoed,"Ulrich Thomsen, Henning Jensen, Mikkel Boe Følsgaard, Cyron Melville, Esben Smed Jensen, Gustav Dyekjaer Giese, Jon Lange, Allan Hyde, Johannes Lassen, Morten Vang Simonsen","Denmark, United Kingdom",6.9,"July 10, 2016"
2973,Sun Dogs,94,2017,"Comedies, Dramas, Independent Movies",Jennifer Morrison,"Michael Angarano, Melissa Benoist, Xzibit, Allison Janney, Ed O'Neill, J.R. Ramirez, Eric Christian Olsen, Niko Nicotera, Nicholas Massouh, Alexander Wraith, Fernando Chien, Tom Berninger","Mexico, United States",6.2,"April 6, 2018"
2974,SunGanges,74,2018,"Documentaries, International Movies",Valli Bindana,Naseeruddin Shah,"India, United States",7.3,"November 15, 2019"
2975,Sunday's Illness,113,2017,"Dramas, Independent Movies, International Movies",Ramón Salazar,"Bárbara Lennie, Susi Sánchez, Miguel Ángel Solá, Richard Bohringer",Spain,6.9,"June 15, 2018"
2976,Sunrise in Heaven,85,2019,"Dramas, Faith & Spirituality, Romantic Movies",Waymon Boone,"Corbin Bernsen, Dee Wallace, Caylee Cowan, Erin Bethea, Travis Burns, Bonnie Burroughs, Jenn Gotzon Chandler, Joseph Nasser, Randy Crowder",United States,6.6,"April 1, 2020"
2978,Super Dark Times,104,2017,"Dramas, Independent Movies, Thrillers",Kevin Phillips,"Owen Campbell, Charlie Tahan, Elizabeth Cappuccino, Max Talisman, Amy Hargreaves, Sawyer Barth, Adea Lennox, Ethan Botwick",United States,6.6,"January 1, 2018"
2979,Super Deluxe,176,2019,"Comedies, Dramas, International Movies",Thiagarajan Kumararaja,"Vijay Sethupathi, Fahadh Faasil, Samantha Ruth Prabhu, Ramya Krishnan, Mysskin, Gayathrie, Ashwanth Ashok Kumar, Bagavathi Perumal",India,8.4,"June 29, 2019"
2982,Super Monsters Save Christmas,24,2019,Children & Family Movies,Steve Ball,"Elyse Maloway, Vincent Tong, Erin Mathews, Andrea Libman, Alessandro Juliani, Nicole Anthony, Diana Kaarina, Ian James Corlett, Britt McKillip, Kathleen Barr, Gigi Saul Guerrero, Brian Drummond",United States,4.4,"November 26, 2019"
2985,Super Monsters: Vida's First Halloween,724,2019,Children & Family Movies,"Jacob Joice, Steve Ball","Gigi Saul Guerrero, Elyse Maloway, Vincent Tong, Erin Mathews, Andrea Libman, Alessandro Juliani, Nicole Anthony, Diana Kaarina, Ian James Corlett, Britt McKillip, Kathleen Barr",United States,6.2,"October 4, 2019"
